date,desc_sentence,desc_logit,desc_prediction,desc_sentiment_score,title_sentence,title_logit,title_prediction,title_sentiment_score,sentence
2019-01-09,"A blockchain project is enabling the public to send and receive crypto through Facebook Messenger, and says this could be the catalyst for mainstream adoption.",[0.19559994 0.00812794 0.79627216],neutral,0.187472,New Bot Enables Millions to Send and Receive Cryptocurrencies on Facebook Messenger,[0.17924204 0.00903366 0.8117243 ],neutral,0.17020838,"New Bot Enables Millions to Send and Receive Cryptocurrencies on Facebook Messenger. A blockchain project is enabling the public to send and receive crypto through Facebook Messenger, and says this could be the catalyst for mainstream adoption."
2019-01-09,"Litecoin creator Charlie Lee has suggested that a decentralized cryptocurrency is by definition exposed to 51 percent attacks, otherwise it is centralized.",[0.0283001  0.08723896 0.8844609 ],neutral,-0.058938857,Litecoin’s Charlie Lee: Decentralized Crypto ‘Must Be Susceptible to 51% Attacks’,[0.07900032 0.02847318 0.89252657],neutral,0.050527137,"Litecoin’s Charlie Lee: Decentralized Crypto ‘Must Be Susceptible to 51% Attacks’. Litecoin creator Charlie Lee has suggested that a decentralized cryptocurrency is by definition exposed to 51 percent attacks, otherwise it is centralized."
2019-01-08,"As major institutional moves in the crypto industry loom on the horizon, we look at what the charts have to say short term.",[0.03778654 0.02499621 0.93721724],neutral,0.012790337,"Bitcoin, Ethereum, Ripple, Bitcoin Cash, EOS, Litecoin, Stellar, Bitcoin SV, TRON, Cardano: Price Analysis, Jan. 7",[0.03625224 0.0167644  0.9469834 ],neutral,0.019487835,"Bitcoin, Ethereum, Ripple, Bitcoin Cash, EOS, Litecoin, Stellar, Bitcoin SV, TRON, Cardano: Price Analysis, Jan. 7. As major institutional moves in the crypto industry loom on the horizon, we look at what the charts have to say short term."
2019-01-08,Litecoin founder Charlie Lee has fired community debate in a tweet alleging that “some self-proclaimed Bitcoin Maximalists are actually Bitcoin Extremists.”,[0.01438432 0.9021509  0.08346473],negative,-0.8877666,Litecoin Founder Stokes Debate Over ‘Bitcoin Extremists’ Tweet,[0.06895052 0.3569786  0.57407093],neutral,-0.28802806,Litecoin Founder Stokes Debate Over ‘Bitcoin Extremists’ Tweet. Litecoin founder Charlie Lee has fired community debate in a tweet alleging that “some self-proclaimed Bitcoin Maximalists are actually Bitcoin Extremists.”
2019-01-07,"Most of the top 20 cryptocurrencies are reporting slight to generous gains, with Bitcoin going above the $4,000 threshold.",[0.9497925  0.02465467 0.02555281],positive,0.9251378,"Bitcoin Tops $4,000 Amid Mostly Green Crypto Markets",[0.75798184 0.08325298 0.15876515],positive,0.6747289,"Bitcoin Tops $4,000 Amid Mostly Green Crypto Markets. Most of the top 20 cryptocurrencies are reporting slight to generous gains, with Bitcoin going above the $4,000 threshold."
2019-01-07,"Most of the top 20 cryptocurrencies are reporting a mix of moderate gains and losses, with Bitcoin hovering over $3,850.",[0.05666112 0.92407775 0.01926112],negative,-0.8674166,"Bitcoin Hovers Оver $3,850 as Top Cryptos See Mixed Signals",[0.05998969 0.91234124 0.02766904],negative,-0.85235155,"Bitcoin Hovers Оver $3,850 as Top Cryptos See Mixed Signals. Most of the top 20 cryptocurrencies are reporting a mix of moderate gains and losses, with Bitcoin hovering over $3,850."
2019-01-05,Naysayers continue to believe that Bitcoin is a scam and can neither become a currency nor act as a store of value.,[0.03816304 0.35736173 0.60447526],neutral,-0.3191987,"Bitcoin, Ethereum, Ripple, Bitcoin Cash, EOS, Stellar, Litecoin, Bitcoin SV, TRON, Cardano: Price Analysis, Jan. 4",[0.03784372 0.01608762 0.94606864],neutral,0.021756098,"Bitcoin, Ethereum, Ripple, Bitcoin Cash, EOS, Stellar, Litecoin, Bitcoin SV, TRON, Cardano: Price Analysis, Jan. 4. Naysayers continue to believe that Bitcoin is a scam and can neither become a currency nor act as a store of value."
2019-01-04,"All major cryptocurrencies are seeing some further corrections today, Bitcoin hovers around $3,800.",[0.9032637  0.05623348 0.0405029 ],positive,0.8470302,"Crypto Markets See Mild Downturn, Bitcoin Holds Near $3,800",[0.11421559 0.83691967 0.04886479],negative,-0.72270405,"Crypto Markets See Mild Downturn, Bitcoin Holds Near $3,800. All major cryptocurrencies are seeing some further corrections today, Bitcoin hovers around $3,800."
2019-01-04,"Crypto markets have dipped back into the red, with most of the top twenty cryptocurrencies by market cap seeing losses capped below 6 percent.",[0.01251108 0.96874535 0.01874357],negative,-0.9562343,"On Bitcoin’s 10th Birthday, Crypto Markets See Corrections Across the Board",[0.0268206  0.93589044 0.03728901],negative,-0.90906984,"On Bitcoin’s 10th Birthday, Crypto Markets See Corrections Across the Board. Crypto markets have dipped back into the red, with most of the top twenty cryptocurrencies by market cap seeing losses capped below 6 percent."
2019-01-03,"While markets are up at the beginning of the new year, some investors remain cautious, suggesting that crypto will not be a safe haven for investors.",[0.04284092 0.9038624  0.05329664],negative,-0.8610215,"Bitcoin, Ethereum, Ripple, Bitcoin Cash, EOS, Stellar, Litecoin, Bitcoin SV, TRON, Cardano: Price Analysis, Jan. 2",[0.03799602 0.01608396 0.94592005],neutral,0.02191206,"Bitcoin, Ethereum, Ripple, Bitcoin Cash, EOS, Stellar, Litecoin, Bitcoin SV, TRON, Cardano: Price Analysis, Jan. 2. While markets are up at the beginning of the new year, some investors remain cautious, suggesting that crypto will not be a safe haven for investors."
2019-01-01,"It is the last day of a very tough year for crypto traders. While 2018 started on an upbeat note, it is ending with uncertainty.",[0.03503282 0.9194693  0.04549796],negative,-0.8844365,"Bitcoin, Ripple, Ethereum, Bitcoin Cash, EOS, Stellar, Litecoin, Bitcoin SV, TRON, Cardano: Price Analysis, Dec. 31",[0.0326037  0.01757907 0.94981724],neutral,0.01502463,"Bitcoin, Ripple, Ethereum, Bitcoin Cash, EOS, Stellar, Litecoin, Bitcoin SV, TRON, Cardano: Price Analysis, Dec. 31. It is the last day of a very tough year for crypto traders. While 2018 started on an upbeat note, it is ending with uncertainty."
2018-12-31,"On the cusp of the new year, most of the top 20 cryptocurrencies by market cap are in the red, with losses capped below 6 percent.",[0.06587774 0.9018036  0.03231866],negative,-0.8359259,"Crypto Markets Teeter on New Year's Eve, With Mostly Losses Across the Board",[0.01563579 0.9699303  0.01443387],negative,-0.9542945,"Crypto Markets Teeter on New Year's Eve, With Mostly Losses Across the Board. On the cusp of the new year, most of the top 20 cryptocurrencies by market cap are in the red, with losses capped below 6 percent."
2018-12-29,"Crypto markets have given up some of their recent gains, which is expected. Rarely do markets bottom without forming a basing pattern.",[0.02691637 0.7565167  0.216567  ],negative,-0.7296003,"Bitcoin, Ripple, Ethereum, Bitcoin Cash, EOS, Stellar, Litecoin, Bitcoin SV, TRON, Cardano: Price Analysis, Dec. 28",[0.03486264 0.01717366 0.9479638 ],neutral,0.017688988,"Bitcoin, Ripple, Ethereum, Bitcoin Cash, EOS, Stellar, Litecoin, Bitcoin SV, TRON, Cardano: Price Analysis, Dec. 28. Crypto markets have given up some of their recent gains, which is expected. Rarely do markets bottom without forming a basing pattern."
2018-12-28,"Markets have taken a renewed plunge, with virtually all of the top 100 cryptocurrencies in the red today.",[0.01748262 0.96008956 0.02242783],negative,-0.9426069,"Markets Take Renewed Downturn, Cryptos Hit By Strong Losses Across The Board",[0.0187191  0.96172965 0.0195512 ],negative,-0.94301057,"Markets Take Renewed Downturn, Cryptos Hit By Strong Losses Across The Board. Markets have taken a renewed plunge, with virtually all of the top 100 cryptocurrencies in the red today."
2018-12-27,The Litecoin Foundation will sponsor a mixed martial arts title fight in the Ultimate Fighting Championship as part of its effort to expand crypto adoption.,[0.4765289  0.00761829 0.51585275],neutral,0.46891063,Litecoin Foundation to Sponsor UFC Title Fight in Bid to Increase Crypto Adoption,[0.82027876 0.00760323 0.17211798],positive,0.81267554,Litecoin Foundation to Sponsor UFC Title Fight in Bid to Increase Crypto Adoption. The Litecoin Foundation will sponsor a mixed martial arts title fight in the Ultimate Fighting Championship as part of its effort to expand crypto adoption.
2018-12-27,"Institutional activity, regulations, and wider adoption will be some of the triggers that will be closely watched during the crypto recovery.",[0.0467831  0.01972147 0.9334954 ],neutral,0.027061628,"Bitcoin, Ripple, Ethereum, Bitcoin Cash, EOS, Stellar, Litecoin, Bitcoin SV, TRON, Cardano: Price Analysis, Dec. 26",[0.03381373 0.01769475 0.9484915 ],neutral,0.016118987,"Bitcoin, Ripple, Ethereum, Bitcoin Cash, EOS, Stellar, Litecoin, Bitcoin SV, TRON, Cardano: Price Analysis, Dec. 26. Institutional activity, regulations, and wider adoption will be some of the triggers that will be closely watched during the crypto recovery."
2018-12-27,Markets are tentatively recovering after hefty losses hit all major cryptocurrencies yesterday on Christmas Day.,[0.7966657  0.17793068 0.02540361],positive,0.6187351,Markets Remain Checkered After Christmas With Red and Green Across the Board,[0.0826752  0.13885535 0.7784695 ],neutral,-0.056180157,Markets Remain Checkered After Christmas With Red and Green Across the Board. Markets are tentatively recovering after hefty losses hit all major cryptocurrencies yesterday on Christmas Day.
2018-12-25,"The crypto market has seen all green this Christmas Eve, with Bitcoin solidly above the $4,000 mark.",[0.9367938  0.02599934 0.0372068 ],positive,0.9107945,"Bitcoin, Ripple, Ethereum, Bitcoin Cash, Stellar, EOS, Litecoin, Bitcoin SV, TRON, Cardano: Price Analysis, Dec. 24",[0.03634105 0.01645474 0.9472042 ],neutral,0.019886315,"Bitcoin, Ripple, Ethereum, Bitcoin Cash, Stellar, EOS, Litecoin, Bitcoin SV, TRON, Cardano: Price Analysis, Dec. 24. The crypto market has seen all green this Christmas Eve, with Bitcoin solidly above the $4,000 mark."
2018-12-22,Many crypto projects are still receiving funding even as the crypto market ends the year lower than some experts predicted.,[0.01883315 0.96320564 0.01796121],negative,-0.9443725,"Bitcoin, Ripple, Ethereum, Bitcoin Cash, Stellar, EOS, Litecoin, Bitcoin SV, TRON, Cardano: Price Analysis, Dec. 21",[0.03347191 0.01788543 0.9486427 ],neutral,0.015586486,"Bitcoin, Ripple, Ethereum, Bitcoin Cash, Stellar, EOS, Litecoin, Bitcoin SV, TRON, Cardano: Price Analysis, Dec. 21. Many crypto projects are still receiving funding even as the crypto market ends the year lower than some experts predicted."
2018-12-21,"Coinbase recently made what it claims is the biggest cryptocurrency transfer on record, moving about $5 billion.",[0.09225475 0.01414503 0.8936002 ],neutral,0.07810973,"Coinbase Moves $5 Billion, Reports Largest Crypto Transfer on Record",[0.2933168  0.02365847 0.68302476],neutral,0.26965833,"Coinbase Moves $5 Billion, Reports Largest Crypto Transfer on Record. Coinbase recently made what it claims is the biggest cryptocurrency transfer on record, moving about $5 billion."
2018-12-20,"Markets are up slightly over the last few days, with some saying that prices have nearly found a bottom.",[0.92969984 0.04465643 0.02564379],positive,0.8850434,"Bitcoin, Ripple, Ethereum, EOS, Stellar, Bitcoin Cash, Litecoin, Bitcoin SV, TRON, Cardano: Price Analysis, Dec. 19",[0.033894   0.01765091 0.9484551 ],neutral,0.01624309,"Bitcoin, Ripple, Ethereum, EOS, Stellar, Bitcoin Cash, Litecoin, Bitcoin SV, TRON, Cardano: Price Analysis, Dec. 19. Markets are up slightly over the last few days, with some saying that prices have nearly found a bottom."
2018-12-18,"One year ago today, Bitcoin hit $20,000. As a sharp rally from current levels seems unlikely investors should have a long-term horizon and not expect overnight riches.",[0.41269842 0.16183478 0.4254668 ],neutral,0.25086364,"Bitcoin, Ripple, Ethereum, Stellar, EOS, Litecoin, Bitcoin Cash, Bitcoin SV, TRON, Cardano: Price Analysis, Dec. 17",[0.03375403 0.01783412 0.9484119 ],neutral,0.015919905,"Bitcoin, Ripple, Ethereum, Stellar, EOS, Litecoin, Bitcoin Cash, Bitcoin SV, TRON, Cardano: Price Analysis, Dec. 17. One year ago today, Bitcoin hit $20,000. As a sharp rally from current levels seems unlikely investors should have a long-term horizon and not expect overnight riches."
2018-12-17,A rare first in current market conditions saw Ethereum leave Bitcoin Cash behind in terms of USD price.,[0.28901944 0.22385153 0.487129  ],neutral,0.065167904,Ethereum Beats Bitcoin Cash’s Price for First Time Ever as Crypto Markets See Growth,[0.90930337 0.01625091 0.07444572],positive,0.89305246,Ethereum Beats Bitcoin Cash’s Price for First Time Ever as Crypto Markets See Growth. A rare first in current market conditions saw Ethereum leave Bitcoin Cash behind in terms of USD price.
2018-12-17,"The top 20 cryptocurrencies are all in the green, two of them reporting double-digit gains, Bitcoin approaches over $3,300.",[0.87503654 0.02696592 0.09799748],positive,0.8480706,"Greenlight: All Top Cryptos See Gains, Bitcoin Nears $3,300",[0.9291281  0.02054923 0.05032273],positive,0.9085789,"Greenlight: All Top Cryptos See Gains, Bitcoin Nears $3,300. The top 20 cryptocurrencies are all in the green, two of them reporting double-digit gains, Bitcoin approaches over $3,300."
2018-12-17,"A year after reaching all time highs, some of the top performers are testing year-to-date lows.",[0.12167345 0.7695364  0.1087902 ],negative,-0.6478629,"Top 5 Crypto Performers Overview: EOS, Binance Coin, TRON, Litecoin, Bitcoin",[0.04785007 0.01955944 0.93259054],neutral,0.028290628,"Top 5 Crypto Performers Overview: EOS, Binance Coin, TRON, Litecoin, Bitcoin. A year after reaching all time highs, some of the top performers are testing year-to-date lows."
2018-12-16,"Top cryptocurrencies report moderate losses and Bitcoin briefly dips under the $3,200 mark in the past 24 hours.",[0.01319093 0.9705564  0.01625271],negative,-0.95736545,"Top Cryptos See Mixed Gains & Losses, Bitcoin Fights to Stay Over $3,200",[0.75250304 0.20180024 0.04569675],positive,0.5507028,"Top Cryptos See Mixed Gains & Losses, Bitcoin Fights to Stay Over $3,200. Top cryptocurrencies report moderate losses and Bitcoin briefly dips under the $3,200 mark in the past 24 hours."
2018-12-15,"While total market cap threatens to break below $100 billion, new research shows that the amount of crypto users doubled by Q3 2018. Does this signal a recovery in the future?",[0.80856174 0.05621077 0.13522758],positive,0.752351,"Bitcoin, Ripple, Ethereum, Stellar, EOS, Bitcoin Cash, Litecoin, Bitcoin SV, TRON, Cardano: Price Analysis, Dec. 14",[0.03550519 0.01683418 0.94766057],neutral,0.018671006,"Bitcoin, Ripple, Ethereum, Stellar, EOS, Bitcoin Cash, Litecoin, Bitcoin SV, TRON, Cardano: Price Analysis, Dec. 14. While total market cap threatens to break below $100 billion, new research shows that the amount of crypto users doubled by Q3 2018. Does this signal a recovery in the future?"
2018-12-13,"The recent slump in markets has provided traders with a good buying opportunity, but a recovery may not come in the form of a dramatic vertical rally.",[0.9197522  0.05429526 0.02595259],positive,0.86545694,"Bitcoin, Ripple, Ethereum, Stellar, EOS, Bitcoin Cash, Bitcoin SV, Litecoin, TRON, Cardano: Price Analysis, Dec. 12",[0.03495437 0.01679243 0.94825315],neutral,0.01816194,"Bitcoin, Ripple, Ethereum, Stellar, EOS, Bitcoin Cash, Bitcoin SV, Litecoin, TRON, Cardano: Price Analysis, Dec. 12. The recent slump in markets has provided traders with a good buying opportunity, but a recovery may not come in the form of a dramatic vertical rally."
2018-12-11,The trade volume of retail investors has been dropping and there is still a lack of participation from traditional investors like investment banks.,[0.00733817 0.9675875  0.02507438],negative,-0.9602493,"Bitcoin, Ripple, Ethereum, Stellar, Bitcoin Cash, Bitcoin SV, EOS, Litecoin, TRON, Cardano: Price Analysis, Dec. 10",[0.0340879  0.01734484 0.9485673 ],neutral,0.016743055,"Bitcoin, Ripple, Ethereum, Stellar, Bitcoin Cash, Bitcoin SV, EOS, Litecoin, TRON, Cardano: Price Analysis, Dec. 10. The trade volume of retail investors has been dropping and there is still a lack of participation from traditional investors like investment banks."
2018-12-08,Markets are down following more delays on a Bitcoin ETF decision from the U.S. SEC. Let’s consult the charts and see how top coins are faring.,[0.00854038 0.95335406 0.03810555],negative,-0.94481367,"Bitcoin, Ripple, Ethereum, Stellar, Bitcoin Cash, Bitcoin SV, EOS, Litecoin, TRON, Cardano: Price Analysis, Dec. 7",[0.0350593  0.01712652 0.9478142 ],neutral,0.017932773,"Bitcoin, Ripple, Ethereum, Stellar, Bitcoin Cash, Bitcoin SV, EOS, Litecoin, TRON, Cardano: Price Analysis, Dec. 7. Markets are down following more delays on a Bitcoin ETF decision from the U.S. SEC. Let’s consult the charts and see how top coins are faring."
2018-12-07,"Crypto markets have today again taken a major downturn, with virtually all of the major coins by market cap seeing double digit losses — some as high as over 20 percent.",[0.01006024 0.9726811  0.0172586 ],negative,-0.96262085,"Market Mayhem: Bitcoin Sinks Below $3.4K, Ethereum Plummets to Double Digits",[0.00998004 0.95176995 0.03825004],negative,-0.9417899,"Market Mayhem: Bitcoin Sinks Below $3.4K, Ethereum Plummets to Double Digits. Crypto markets have today again taken a major downturn, with virtually all of the major coins by market cap seeing double digit losses — some as high as over 20 percent."
2018-12-06,"While expert opinions over Bitcoin’s future vary, the current bear market has failed to deter investment from large players, showing that interest in the space in alive and well.",[0.82452965 0.12380917 0.05166119],positive,0.7007205,"Bitcoin, Ripple, Ethereum, Stellar, Bitcoin Cash, EOS, Litecoin, Cardano, TRON, Monero: Price Analysis, Dec. 5",[0.03710753 0.0166468  0.9462457 ],neutral,0.020460729,"Bitcoin, Ripple, Ethereum, Stellar, Bitcoin Cash, EOS, Litecoin, Cardano, TRON, Monero: Price Analysis, Dec. 5. While expert opinions over Bitcoin’s future vary, the current bear market has failed to deter investment from large players, showing that interest in the space in alive and well."
2018-12-04,"Fidelity Investments, Nasdaq Ventures and others have invested a total of $27.5 million in crypto exchange ErisX.",[0.09418153 0.00980651 0.89601195],neutral,0.084375024,"Crypto Exchange ErisX Raises $27.5 Million From Fidelity, Nasdaq Ventures and Others",[0.578937   0.01350455 0.40755847],positive,0.5654324,"Crypto Exchange ErisX Raises $27.5 Million From Fidelity, Nasdaq Ventures and Others. Fidelity Investments, Nasdaq Ventures and others have invested a total of $27.5 million in crypto exchange ErisX."
2018-12-04,"Top coins are shaky as Bitcoin falls back below the $4,000 mark, but increased institutional interest — like Coinbase’s new OTC desk — could signal a turnaround.",[0.8607201  0.11622898 0.02305088],positive,0.7444911,"Bitcoin, Ripple, Ethereum, Bitcoin Cash, Stellar, EOS, Litecoin, Cardano, Monero, TRON: Price Analysis, Dec. 3",[0.03543632 0.01742088 0.9471428 ],neutral,0.018015442,"Bitcoin, Ripple, Ethereum, Bitcoin Cash, Stellar, EOS, Litecoin, Cardano, Monero, TRON: Price Analysis, Dec. 3. Top coins are shaky as Bitcoin falls back below the $4,000 mark, but increased institutional interest — like Coinbase’s new OTC desk — could signal a turnaround."
2018-12-04,"Bitcoin has today again lost the $4,000 price point as all major coins see significant losses of between a 4 and 10 percent range.",[0.02285649 0.95644903 0.02069443],negative,-0.93359256,"Crypto Assets See Losses Across the Board as BTC Falls Below $4,000",[0.0100405  0.9714021  0.01855745],negative,-0.9613616,"Crypto Assets See Losses Across the Board as BTC Falls Below $4,000. Bitcoin has today again lost the $4,000 price point as all major coins see significant losses of between a 4 and 10 percent range."
2018-12-03,"Bitcoin closes out its worst November since 2011, while total market cap rallies well above year-to-date lows.",[0.03861162 0.9412464  0.020142  ],negative,-0.9026348,"Top 5 Crypto Performers Overview: TRON, Litecoin, XEM, Bitcoin, Ethereum",[0.04388727 0.02235539 0.93375736],neutral,0.02153187,"Top 5 Crypto Performers Overview: TRON, Litecoin, XEM, Bitcoin, Ethereum. Bitcoin closes out its worst November since 2011, while total market cap rallies well above year-to-date lows."
2018-12-01,"The bears seem to be unwilling to wait for the higher levels to sell Bitcoin, as the market experiences a pullback.",[0.03452022 0.9120185  0.05346126],negative,-0.87749827,"Bitcoin, Ripple, Ethereum, Bitcoin Cash, Stellar, EOS, Litecoin, Cardano, Monero, TRON: Price Analysis, December 1",[0.03432494 0.01840442 0.94727063],neutral,0.015920516,"Bitcoin, Ripple, Ethereum, Bitcoin Cash, Stellar, EOS, Litecoin, Cardano, Monero, TRON: Price Analysis, December 1. The bears seem to be unwilling to wait for the higher levels to sell Bitcoin, as the market experiences a pullback."
2018-11-29,Markets rally today as execs from several big name institutional players express their optimism about crypto’s future as an asset class.,[0.929285   0.02182056 0.04889451],positive,0.90746444,"Bitcoin, Ripple, Ethereum, Bitcoin Cash, Stellar, EOS, Litecoin: Price Analysis, Nov. 28",[0.03183528 0.02022354 0.9479411 ],neutral,0.011611737,"Bitcoin, Ripple, Ethereum, Bitcoin Cash, Stellar, EOS, Litecoin: Price Analysis, Nov. 28. Markets rally today as execs from several big name institutional players express their optimism about crypto’s future as an asset class."
2018-11-28,"After the market crash, Bitcoin has soared back above $4,000, with all major cryptocurrencies seeing strong growth.",[0.95003635 0.019641   0.03032258],positive,0.93039536,"Bitcoin Sees Strongest 24-Hour Performance Since July, Total Market Cap Jumps $11 Bln",[0.894182   0.06964946 0.03616849],positive,0.82453257,"Bitcoin Sees Strongest 24-Hour Performance Since July, Total Market Cap Jumps $11 Bln. After the market crash, Bitcoin has soared back above $4,000, with all major cryptocurrencies seeing strong growth."
2018-11-27,Rampant selling in recent weeks dragged total market capitalization from above $210 billion on Nov. 14 to just below $116 billion on Nov. 25.,[0.02766323 0.94725883 0.02507791],negative,-0.9195956,"Bitcoin, Ripple, Ethereum, Bitcoin Cash, Stellar, EOS, Litecoin, Cardano, Monero, TRON: Price Analysis, Nov. 26",[0.03253122 0.01855904 0.94890976],neutral,0.013972184,"Bitcoin, Ripple, Ethereum, Bitcoin Cash, Stellar, EOS, Litecoin, Cardano, Monero, TRON: Price Analysis, Nov. 26. Rampant selling in recent weeks dragged total market capitalization from above $210 billion on Nov. 14 to just below $116 billion on Nov. 25."
2018-11-24,"While a price crash can indicate decaying asset class fundamentals, markets often get the fundamentals of new technology wrong.",[0.01011075 0.94044495 0.04944431],negative,-0.9303342,"Bitcoin, Ripple, Ethereum, Stellar, EOS, Litecoin, Cardano, Monero, TRON, Dash: Price Analysis, Nov. 23",[0.03123794 0.01879249 0.94996953],neutral,0.012445452,"Bitcoin, Ripple, Ethereum, Stellar, EOS, Litecoin, Cardano, Monero, TRON, Dash: Price Analysis, Nov. 23. While a price crash can indicate decaying asset class fundamentals, markets often get the fundamentals of new technology wrong."
2018-11-22,"The world did not come to an end after the financial crisis of 2007–2008. Similarly, this bear market will also pass and the stronger cryptocurrencies will rise and reward investors.",[0.88089997 0.01482202 0.10427792],positive,0.86607796,"Bitcoin, Ripple, Ethereum, Stellar, EOS, Litecoin, Cardano, Monero, TRON, Dash: Price Analysis, Nov. 21",[0.03068391 0.01936483 0.94995123],neutral,0.011319077,"Bitcoin, Ripple, Ethereum, Stellar, EOS, Litecoin, Cardano, Monero, TRON, Dash: Price Analysis, Nov. 21. The world did not come to an end after the financial crisis of 2007–2008. Similarly, this bear market will also pass and the stronger cryptocurrencies will rise and reward investors."
2018-11-20,"Following the increase in volatility and a renewed downtrend in markets, some analysts have projected abysmally low prices for Bitcoin.",[0.01192646 0.96949154 0.01858191],negative,-0.95756507,"Bitcoin, Ripple, Ethereum, Stellar, EOS, Litecoin, Cardano, Monero, TRON, IOTA: Price Analysis, Nov. 19",[0.0346026  0.01694649 0.94845086],neutral,0.01765611,"Bitcoin, Ripple, Ethereum, Stellar, EOS, Litecoin, Cardano, Monero, TRON, IOTA: Price Analysis, Nov. 19. Following the increase in volatility and a renewed downtrend in markets, some analysts have projected abysmally low prices for Bitcoin."
2018-11-18,"The fourth largest European stock exchange, SIX Swiss Exchange, will list the world’s first multi-crypto exchange-traded product next week.",[0.06134905 0.0126528  0.92599815],neutral,0.048696253,Major Swiss Stock Exchange SIX Lists World’s First Multi-Crypto ETP Amidst Market Collapse,[0.11465609 0.01208207 0.8732618 ],neutral,0.10257402,"Major Swiss Stock Exchange SIX Lists World’s First Multi-Crypto ETP Amidst Market Collapse. The fourth largest European stock exchange, SIX Swiss Exchange, will list the world’s first multi-crypto exchange-traded product next week."
