date,desc_sentence,desc_logit,desc_prediction,desc_sentiment_score,title_sentence,title_logit,title_prediction,title_sentiment_score,sentence
2020-12-26,Bitcoin price remains in a strong uptrend and this presents a rosy outlook for BTC and many altcoins.,[0.0318592  0.9539821  0.01415874],negative,-0.9221229,"2021 price outlook: BTC, ETH, XRP, LTC, BCH, LINK, ADA, BNB, DOT, XLM",[0.03588702 0.01775973 0.94635326],neutral,0.018127292,"2021 price outlook: BTC, ETH, XRP, LTC, BCH, LINK, ADA, BNB, DOT, XLM. Bitcoin price remains in a strong uptrend and this presents a rosy outlook for BTC and many altcoins."
2020-12-17,"Bitcoin’s surge to $23,800 triggered strong rallies in large-cap altcoins like Litecoin and Dogecoin.",[0.942403   0.02536407 0.03223294],positive,0.917039,"Litecoin, Dogecoin and large-cap altcoins rally as Bitcoin price hits $23.8K",[0.68616575 0.1858144  0.12801988],positive,0.50035137,"Litecoin, Dogecoin and large-cap altcoins rally as Bitcoin price hits $23.8K. Bitcoin’s surge to $23,800 triggered strong rallies in large-cap altcoins like Litecoin and Dogecoin."
2020-11-25,Bitcoin and most major altcoins could consolidate for a few days before starting the next big move.,[0.04838684 0.0721857  0.8794275 ],neutral,-0.023798864,"Price analysis 11/25: BTC, ETH, XRP, BCH, LINK, LTC, ADA, DOT, BNB, XLM",[0.02814199 0.01931455 0.95254344],neutral,0.008827446,"Price analysis 11/25: BTC, ETH, XRP, BCH, LINK, LTC, ADA, DOT, BNB, XLM. Bitcoin and most major altcoins could consolidate for a few days before starting the next big move."
2020-11-20,Ether hits two-and-a-half-year highs and follows Bitcoin to reach significant psychological levels this week.,[0.9359385  0.02351572 0.04054577],positive,0.9124228,"Ether hits $500 for the first time since June 2018, outperforming Bitcoin YTD",[0.91035706 0.06274308 0.02689981],positive,0.847614,"Ether hits $500 for the first time since June 2018, outperforming Bitcoin YTD. Ether hits two-and-a-half-year highs and follows Bitcoin to reach significant psychological levels this week."
2020-11-13,"Bitcoin’s explosive gains are strongly reflected by the number of days it has closed above $16,320.",[0.94942236 0.02195534 0.02862232],positive,0.927467,The Bitcoin price has only been higher than now for 12 days in its history,[0.40235788 0.03970791 0.5579342 ],neutral,0.36264998,"The Bitcoin price has only been higher than now for 12 days in its history. Bitcoin’s explosive gains are strongly reflected by the number of days it has closed above $16,320."
2020-11-10,The embattled spin-off of Bitcoin shows little signs of life prior to its hard fork as Bitcoin vastly outstrips its performance.,[0.32128578 0.5715378  0.10717649],negative,-0.250252,Bitcoin Cash hits record lows vs. Bitcoin days before hard fork,[0.01990753 0.9448084  0.03528402],negative,-0.9249009,Bitcoin Cash hits record lows vs. Bitcoin days before hard fork. The embattled spin-off of Bitcoin shows little signs of life prior to its hard fork as Bitcoin vastly outstrips its performance.
2020-11-02,"Bitcoin is facing selling at the $14,000 mark and this has resulted in several cryptocurrencies dropping below their support levels.",[0.00790409 0.9736984  0.01839758],negative,-0.96579427,"Price analysis 11/2: BTC, ETH, XRP, BCH, LINK, BNB, LTC, DOT, BSV, ADA",[0.02930098 0.01949565 0.95120335],neutral,0.009805333,"Price analysis 11/2: BTC, ETH, XRP, BCH, LINK, BNB, LTC, DOT, BSV, ADA. Bitcoin is facing selling at the $14,000 mark and this has resulted in several cryptocurrencies dropping below their support levels."
2020-10-21,"News of PayPal’s support for crypto assets has triggered a rally in the markets, with Bitcoin trading above $13,000 for the first time since July.",[0.94379026 0.0261371  0.03007266],positive,0.91765314,Bitcoin blasts through $13K following PayPal’s entrance into crypto,[0.593003   0.06560268 0.34139434],positive,0.5274003,"Bitcoin blasts through $13K following PayPal’s entrance into crypto. News of PayPal’s support for crypto assets has triggered a rally in the markets, with Bitcoin trading above $13,000 for the first time since July."
2020-10-21,"The long-awaited “flippening” of fiat at PayPal will begin next year, as Bitcoin price action offers almost 5% daily gains.",[0.9147505  0.01074393 0.07450556],positive,0.9040066,Bitcoin breaks above $12.3K after PayPal says Venmo will become a BTC wallet,[0.6549416  0.05109224 0.2939662 ],positive,0.60384935,"Bitcoin breaks above $12.3K after PayPal says Venmo will become a BTC wallet. The long-awaited “flippening” of fiat at PayPal will begin next year, as Bitcoin price action offers almost 5% daily gains."
2020-10-18,"Traders are accumulating Bitcoin on dips and a break above $11,600 could resume the uptrend to $12,000.",[0.37051034 0.589846   0.03964365],negative,-0.21933568,"Top 5 cryptocurrencies to watch this week: BTC, XLM, CRO, BNB, LTC",[0.03816172 0.02158507 0.9402532 ],neutral,0.016576651,"Top 5 cryptocurrencies to watch this week: BTC, XLM, CRO, BNB, LTC. Traders are accumulating Bitcoin on dips and a break above $11,600 could resume the uptrend to $12,000."
2020-10-14,"Bitcoin and most major altcoins are sustaining above their immediate support levels, increasing the possibility that the uptrend will resume.",[0.55491465 0.42030752 0.02477785],positive,0.13460714,"Price analysis 10/14: BTC, ETH, XRP, BCH, BNB, LINK, DOT, ADA, LTC, BSV",[0.02740199 0.02002836 0.9525696 ],neutral,0.0073736235,"Price analysis 10/14: BTC, ETH, XRP, BCH, BNB, LINK, DOT, ADA, LTC, BSV. Bitcoin and most major altcoins are sustaining above their immediate support levels, increasing the possibility that the uptrend will resume."
2020-10-12,"Bitcoin’s strength above the $11,500 multi-year resistance is also pulling many altcoin prices higher.",[0.19239506 0.7734142  0.03419073],negative,-0.58101916,"Price analysis 10/12: BTC, ETH, XRP, BCH, BNB, LINK, DOT, ADA, LTC, CRO",[0.02511567 0.02136706 0.95351726],neutral,0.0037486125,"Price analysis 10/12: BTC, ETH, XRP, BCH, BNB, LINK, DOT, ADA, LTC, CRO. Bitcoin’s strength above the $11,500 multi-year resistance is also pulling many altcoin prices higher."
2020-10-09,"Bitcoin and select altcoins have broken out of their bullish setups, hinting that further upside could occur through the weekend.",[0.80103165 0.16982006 0.02914828],positive,0.6312116,"Price analysis 10/9: BTC, ETH, XRP, BCH, BNB, DOT, LINK, CRO, LTC, BSV",[0.02512196 0.02297289 0.95190513],neutral,0.0021490678,"Price analysis 10/9: BTC, ETH, XRP, BCH, BNB, DOT, LINK, CRO, LTC, BSV. Bitcoin and select altcoins have broken out of their bullish setups, hinting that further upside could occur through the weekend."
2020-10-07,Bitcoin and altcoins could remain range-bound for a few days as traders search for triggers that will start the next trending move.,[0.04167842 0.5530398  0.4052818 ],negative,-0.51136136,"Price analysis 10/7: BTC, ETH, XRP, BCH, BNB, DOT, LINK, LTC, CRO, BSV",[0.02503675 0.02312781 0.9518355 ],neutral,0.0019089356,"Price analysis 10/7: BTC, ETH, XRP, BCH, BNB, DOT, LINK, LTC, CRO, BSV. Bitcoin and altcoins could remain range-bound for a few days as traders search for triggers that will start the next trending move."
2020-10-06,Litecoin's privacy feature testnet returns as news emerges that Europol sees privacy and coin mixing technologies as major digital threats,[0.75594383 0.10753992 0.13651624],positive,0.6484039,Litecoin relaunches MimbleWimble testnet as Europol targets privacy protocols,[0.04024331 0.03875522 0.9210015 ],neutral,0.0014880858,Litecoin relaunches MimbleWimble testnet as Europol targets privacy protocols. Litecoin's privacy feature testnet returns as news emerges that Europol sees privacy and coin mixing technologies as major digital threats
2020-10-06,Traders are attempting to kickstart a new trending move in Bitcoin and altcoins by attacking overhead resistance levels.,[0.21590364 0.58496505 0.19913132],negative,-0.3690614,"Price analysis 10/5: BTC, ETH, XRP, BNB, BCH, DOT, LINK, CRO, LTC, ADA",[0.02592908 0.02199517 0.9520757 ],neutral,0.003933916,"Price analysis 10/5: BTC, ETH, XRP, BNB, BCH, DOT, LINK, CRO, LTC, ADA. Traders are attempting to kickstart a new trending move in Bitcoin and altcoins by attacking overhead resistance levels."
2020-10-03,"The bulls are buying the dips in Bitcoin and a few altcoins, suggesting that investor sentiment remains positive.",[0.9226029  0.04111368 0.03628349],positive,0.8814892,"Price analysis 10/2: BTC, ETH, XRP, BCH, BNB, DOT, LINK, CRO, BSV, LTC",[0.02591349 0.02174252 0.952344  ],neutral,0.0041709673,"Price analysis 10/2: BTC, ETH, XRP, BCH, BNB, DOT, LINK, CRO, BSV, LTC. The bulls are buying the dips in Bitcoin and a few altcoins, suggesting that investor sentiment remains positive."
2020-09-26,"Bitcoin and altcoins rebounded off their critical support levels, possibly creating a path to a new bullish uptrend.",[0.94126654 0.03396165 0.02477174],positive,0.9073049,"Price analysis 9/25: BTC, ETH, XRP, BCH, DOT, LINK, BNB, CRO, LTC, BSV",[0.02753715 0.02077859 0.9516843 ],neutral,0.0067585595,"Price analysis 9/25: BTC, ETH, XRP, BCH, DOT, LINK, BNB, CRO, LTC, BSV. Bitcoin and altcoins rebounded off their critical support levels, possibly creating a path to a new bullish uptrend."
2020-09-24,Bitcoin and altcoins are at risk of a deeper correction if they do not rise above their immediate resistance levels soon.,[0.0155     0.9547486  0.02975148],negative,-0.93924856,"Price analysis 9/23: BTC, ETH, XRP, BCH, DOT, BNB, CRO, LTC, LINK, BSV",[0.02793115 0.02065206 0.95141685],neutral,0.0072790924,"Price analysis 9/23: BTC, ETH, XRP, BCH, DOT, BNB, CRO, LTC, LINK, BSV. Bitcoin and altcoins are at risk of a deeper correction if they do not rise above their immediate resistance levels soon."
2020-09-24,Idle games are brilliant at soaking up your time and leaving you with nothing in return. But what if you could earn LTC in the process?,[0.10912913 0.02191896 0.8689519 ],neutral,0.08721017,Game review: Can 'LiteBringer' do what it says on the tin?,[0.03582018 0.02621681 0.93796295],neutral,0.009603372,Game review: Can 'LiteBringer' do what it says on the tin?. Idle games are brilliant at soaking up your time and leaving you with nothing in return. But what if you could earn LTC in the process?
2020-09-22,The market has taken a bearish turn and Bitcoin and altcoins will need strong relief rallies in order to restore their uptrends.,[0.49532375 0.46198198 0.0426943 ],positive,0.033341765,"Price analysis 9/21: BTC, ETH, XRP, BCH, DOT, BNB, LINK, CRO, LTC, BSV",[0.02713406 0.02155303 0.95131296],neutral,0.005581038,"Price analysis 9/21: BTC, ETH, XRP, BCH, DOT, BNB, LINK, CRO, LTC, BSV. The market has taken a bearish turn and Bitcoin and altcoins will need strong relief rallies in order to restore their uptrends."
2020-09-19,"Bitcoin and altcoins are facing selling near key resistance levels, but for now the possibility of a sharp fall remains low.",[0.48843303 0.47407582 0.03749108],positive,0.014357209,"Price analysis 9/18: BTC, ETH, XRP, DOT, BCH, BNB, LINK, CRO, LTC, BSV",[0.02701029 0.02160228 0.95138747],neutral,0.005408002,"Price analysis 9/18: BTC, ETH, XRP, DOT, BCH, BNB, LINK, CRO, LTC, BSV. Bitcoin and altcoins are facing selling near key resistance levels, but for now the possibility of a sharp fall remains low."
2020-09-17,"Bitcoin and a few altcoins have broken above key resistance levels, which suggests that the bulls are attempting to take control of the market.",[0.205251   0.67781305 0.11693604],negative,-0.47256207,"Price analysis 9/16: BTC, ETH, XRP, DOT, BCH, BNB, LINK, CRO, LTC, BSV",[0.02765772 0.02116251 0.9511798 ],neutral,0.0064952057,"Price analysis 9/16: BTC, ETH, XRP, DOT, BCH, BNB, LINK, CRO, LTC, BSV. Bitcoin and a few altcoins have broken above key resistance levels, which suggests that the bulls are attempting to take control of the market."
2020-09-16,"“It’s the first major game that utilizes the Litecoin blockchain for all of its interactions,” said LTC creator Charlie Lee.",[0.10372961 0.0100182  0.8862522 ],neutral,0.093711406,Germany-based gaming company releases RPG on the Litecoin blockchain,[0.02790757 0.02181046 0.9502819 ],neutral,0.0060971137,"Germany-based gaming company releases RPG on the Litecoin blockchain. “It’s the first major game that utilizes the Litecoin blockchain for all of its interactions,” said LTC creator Charlie Lee."
2020-09-15,Bitcoin and several altcoins are trying to break out of their respective overhead resistance levels in order to restore bullish momentum.,[0.9152273  0.02267186 0.06210088],positive,0.8925554,"Price analysis 9/14: BTC, ETH, XRP, BNB, DOT, LINK, BCH, CRO, LTC, BSV",[0.02717239 0.02161641 0.9512112 ],neutral,0.005555976,"Price analysis 9/14: BTC, ETH, XRP, BNB, DOT, LINK, BCH, CRO, LTC, BSV. Bitcoin and several altcoins are trying to break out of their respective overhead resistance levels in order to restore bullish momentum."
2020-09-12,"Although Bitcoin price is range-bound, a few altcoins have started a relief rally which could push them above key resistance levels.",[0.9478656  0.03017338 0.02196107],positive,0.91769224,"Price analysis 9/11: BTC, ETH, XRP, LINK, BCH, DOT, BNB, LTC, CRO, BSV",[0.02586078 0.02267355 0.9514656 ],neutral,0.003187228,"Price analysis 9/11: BTC, ETH, XRP, LINK, BCH, DOT, BNB, LTC, CRO, BSV. Although Bitcoin price is range-bound, a few altcoins have started a relief rally which could push them above key resistance levels."
2020-09-10,If the bulls can find momentum from the current bounce in Bitcoin and altcoins a short-term bottom may be in place.,[0.04966648 0.8672246  0.08310884],negative,-0.8175581,"Price analysis 9/9: BTC, ETH, XRP, LINK, BCH, DOT, BNB, BSV, LTC, CRO",[0.02527574 0.02285026 0.951874  ],neutral,0.0024254806,"Price analysis 9/9: BTC, ETH, XRP, LINK, BCH, DOT, BNB, BSV, LTC, CRO. If the bulls can find momentum from the current bounce in Bitcoin and altcoins a short-term bottom may be in place."
2020-09-08,Bitcoin and altcoins could consolidate in a tight range for a few days before making the next decisive move.,[0.08626639 0.06681387 0.8469198 ],neutral,0.01945252,"Price analysis 9/7: BTC, ETH, XRP, LINK, BCH, DOT, BSV, BNB, LTC, CRO",[0.02597469 0.0216261  0.95239913],neutral,0.0043485947,"Price analysis 9/7: BTC, ETH, XRP, LINK, BCH, DOT, BSV, BNB, LTC, CRO. Bitcoin and altcoins could consolidate in a tight range for a few days before making the next decisive move."
2020-09-05,A dead cat bounce from Bitcoin and altcoins’ critical support levels may attract further selling that could result in lower levels over the next few days.,[0.01471173 0.9629595  0.0223288 ],negative,-0.9482478,"Price analysis 9/4: BTC, ETH, XRP, LINK, BCH, DOT, LTC, CRO, BNB, BSV",[0.02669733 0.02205372 0.95124894],neutral,0.004643608,"Price analysis 9/4: BTC, ETH, XRP, LINK, BCH, DOT, LTC, CRO, BNB, BSV. A dead cat bounce from Bitcoin and altcoins’ critical support levels may attract further selling that could result in lower levels over the next few days."
2020-09-03,If the bearish patterns on Bitcoin and altcoins complete the current correction could see prices drop to new lows.,[0.01413112 0.9689192  0.01694961],negative,-0.9547881,"Price analysis 9/2: BTC, ETH, XRP, LINK, BCH, LTC, BNB, CRO, BSV, ADA",[0.03054776 0.01917741 0.9502748 ],neutral,0.011370344,"Price analysis 9/2: BTC, ETH, XRP, LINK, BCH, LTC, BNB, CRO, BSV, ADA. If the bearish patterns on Bitcoin and altcoins complete the current correction could see prices drop to new lows."
2020-09-02,Satoshi Nakamoto would have approved.,[0.09572948 0.04469499 0.8595755 ],neutral,0.051034488,PornHub now accepts Bitcoin and Litecoin,[0.08515823 0.00793869 0.9069031 ],neutral,0.07721954,PornHub now accepts Bitcoin and Litecoin. Satoshi Nakamoto would have approved.
2020-09-01,"Bitcoin and altcoins have bounced off their range lows, but they are likely to encounter resistance at higher levels.",[0.86098164 0.10218524 0.03683315],positive,0.7587964,"Price analysis 8/31: BTC, ETH, XRP, LINK, BCH, LTC, BSV, CRO, BNB, EOS",[0.02821735 0.0196192  0.9521635 ],neutral,0.008598151,"Price analysis 8/31: BTC, ETH, XRP, LINK, BCH, LTC, BSV, CRO, BNB, EOS. Bitcoin and altcoins have bounced off their range lows, but they are likely to encounter resistance at higher levels."
2020-08-29,"Bitcoin and altcoins are holding key support levels, suggesting bulls will try to break above overhead resistance levels soon.",[0.92877436 0.02855091 0.04267482],positive,0.90022343,"Price analysis 8/28: BTC, ETH, XRP, LINK, BCH, LTC, BSV, CRO, BNB, EOS",[0.02929629 0.01955365 0.95115006],neutral,0.009742642,"Price analysis 8/28: BTC, ETH, XRP, LINK, BCH, LTC, BSV, CRO, BNB, EOS. Bitcoin and altcoins are holding key support levels, suggesting bulls will try to break above overhead resistance levels soon."
2020-08-28,"Will altcoins rally as Bitcoin price stagnates, and is DeFi producing a bubble? Here’s what’s driving the altcoin season.",[0.04555359 0.05996006 0.8944863 ],neutral,-0.014406472,Alt season is here? DeFi tokens taking on Bitcoin for crypto dominance,[0.0556238  0.02685137 0.9175249 ],neutral,0.02877243,"Alt season is here? DeFi tokens taking on Bitcoin for crypto dominance. Will altcoins rally as Bitcoin price stagnates, and is DeFi producing a bubble? Here’s what’s driving the altcoin season."
2020-08-27,Bitcoin and altcoins are likely to remain range-bound in the short-term as the bulls and the bears attempt to assert their dominance.,[0.5690832  0.23864111 0.19227566],positive,0.3304421,"Price analysis 8/26: BTC, ETH, XRP, LINK, BCH, LTC, BSV, CRO, BNB, ADA",[0.03268855 0.0182612  0.9490503 ],neutral,0.014427353,"Price analysis 8/26: BTC, ETH, XRP, LINK, BCH, LTC, BSV, CRO, BNB, ADA. Bitcoin and altcoins are likely to remain range-bound in the short-term as the bulls and the bears attempt to assert their dominance."
2020-08-25,"The bulls are aggressively defending the 20-day EMA in Bitcoin and select altcoins, which could result in the resumption of the uptrend.",[0.8607557  0.06756397 0.07168033],positive,0.79319173,"Price analysis 8/24: BTC, ETH, XRP, BCH, LINK, LTC, BSV, CRO, BNB, ADA",[0.0319292  0.01815421 0.9499166 ],neutral,0.013774993,"Price analysis 8/24: BTC, ETH, XRP, BCH, LINK, LTC, BSV, CRO, BNB, ADA. The bulls are aggressively defending the 20-day EMA in Bitcoin and select altcoins, which could result in the resumption of the uptrend."
2020-08-22,Prices are volatile for Grayscale's LTCN stock asset.,[0.02642057 0.85448784 0.11909159],negative,-0.82806724,Grayscale’s Litecoin-Based Asset Sees Wild Premium Swings,[0.84934306 0.01095636 0.1397006 ],positive,0.8383867,Grayscale’s Litecoin-Based Asset Sees Wild Premium Swings. Prices are volatile for Grayscale's LTCN stock asset.
2020-08-22,"Bitcoin and several altcoins have formed bearish divergences, which suggests that the bullish momentum has weakened.",[0.01873002 0.95914847 0.02212145],negative,-0.9404184,"Price Analysis 8/21: BTC, ETH, XRP, BCH, LINK, LTC, BSV, ADA, BNB, CRO",[0.03071152 0.01787103 0.9514175 ],neutral,0.012840487,"Price Analysis 8/21: BTC, ETH, XRP, BCH, LINK, LTC, BSV, ADA, BNB, CRO. Bitcoin and several altcoins have formed bearish divergences, which suggests that the bullish momentum has weakened."
2020-08-20,Bitcoin and the altcoins continue to correct but lower levels are likely to attract buyers as the bullish macro trend has not changed.,[0.79845196 0.17086935 0.03067872],positive,0.6275826,"Price Analysis 8/19: BTC, ETH, XRP, LINK, BCH, LTC, BSV, ADA, BNB, EOS",[0.03086198 0.01814865 0.95098937],neutral,0.012713326,"Price Analysis 8/19: BTC, ETH, XRP, LINK, BCH, LTC, BSV, ADA, BNB, EOS. Bitcoin and the altcoins continue to correct but lower levels are likely to attract buyers as the bullish macro trend has not changed."
2020-08-18,"Bitcoin’s strong move above the $12,200 resistance could boost sentiment and lead to a stronger rally in select altcoins.",[0.9518681  0.01979049 0.0283415 ],positive,0.93207765,"Price Analysis 8/17: BTC, ETH, XRP, LINK, BCH, LTC, BSV, ADA, EOS, BNB",[0.03000638 0.01832979 0.9516638 ],neutral,0.011676587,"Price Analysis 8/17: BTC, ETH, XRP, LINK, BCH, LTC, BSV, ADA, EOS, BNB. Bitcoin’s strong move above the $12,200 resistance could boost sentiment and lead to a stronger rally in select altcoins."
2020-08-17,The company also happened to clear a Nasdaq and NYSE listing requirement in the process.,[0.1967536  0.06511416 0.7381322 ],neutral,0.13163945,Grayscale Brings Altcoins to Over-the-Counter Trading,[0.4623068  0.01177861 0.5259146 ],neutral,0.4505282,Grayscale Brings Altcoins to Over-the-Counter Trading. The company also happened to clear a Nasdaq and NYSE listing requirement in the process.
2020-08-15,Charlie Lee: Litecoin maximalists don’t exist.,[0.03073089 0.07816297 0.8911062 ],neutral,-0.04743208,First Litecoin-Native Visa Debit Card Is Being Launched,[0.19326894 0.0070819  0.7996492 ],neutral,0.18618703,First Litecoin-Native Visa Debit Card Is Being Launched. Charlie Lee: Litecoin maximalists don’t exist.
2020-08-15,Traders have turned bullish on Ethereum again and the strong break above $400 could pull Bitcoin and other altcoins higher.,[0.90289617 0.07427726 0.02282654],positive,0.8286189,"Price Analysis 8/14: BTC, ETH, XRP, LINK, BCH, BSV, LTC, ADA, BNB, CRO",[0.03016639 0.01807612 0.9517575 ],neutral,0.012090266,"Price Analysis 8/14: BTC, ETH, XRP, LINK, BCH, BSV, LTC, ADA, BNB, CRO. Traders have turned bullish on Ethereum again and the strong break above $400 could pull Bitcoin and other altcoins higher."
2020-08-13,"As Bitcoin price slowly regains momentum, many altcoins have been rewarding traders by rallying to new all-time highs.",[0.939242   0.02112953 0.03962843],positive,0.91811246,"Price Analysis 8/12: BTC, ETH, XRP, LINK, BCH, BSV, LTC, ADA, XTZ, BNB",[0.03220233 0.01689252 0.9509052 ],neutral,0.015309805,"Price Analysis 8/12: BTC, ETH, XRP, LINK, BCH, BSV, LTC, ADA, XTZ, BNB. As Bitcoin price slowly regains momentum, many altcoins have been rewarding traders by rallying to new all-time highs."
2020-08-11,"Bitcoin price continues to decline at $12,000, but altcoins have taken advantage of the range-bound action by rallying higher.",[0.1547625  0.82153857 0.02369893],negative,-0.66677606,"Price Analysis 8/10: BTC, ETH, XRP, BCH, LINK, BSV, LTC, ADA, BNB, CRO",[0.02926707 0.01847598 0.952257  ],neutral,0.010791084,"Price Analysis 8/10: BTC, ETH, XRP, BCH, LINK, BSV, LTC, ADA, BNB, CRO. Bitcoin price continues to decline at $12,000, but altcoins have taken advantage of the range-bound action by rallying higher."
2020-08-08,Bitcoin and altcoins might consolidate or correct marginally for a few days before a possible breakout to the upside.,[0.18895686 0.78193355 0.02910958],negative,-0.5929767,"Price Analysis 8/7: BTC, ETH, XRP, BCH, BSV, LTC, ADA, LINK, BNB, CRO",[0.02822636 0.0191314  0.9526422 ],neutral,0.009094959,"Price Analysis 8/7: BTC, ETH, XRP, BCH, BSV, LTC, ADA, LINK, BNB, CRO. Bitcoin and altcoins might consolidate or correct marginally for a few days before a possible breakout to the upside."
2020-08-06,"If Bitcoin can reclaim the $12,200 level, several altcoins are likely to resume their uptrend.",[0.4991408  0.30564746 0.19521183],positive,0.19349334,"Price Analysis 8/5: BTC, ETH, XRP, BCH, BSV, LTC, ADA, BNB, LINK, CRO",[0.02999181 0.01811918 0.95188904],neutral,0.011872623,"Price Analysis 8/5: BTC, ETH, XRP, BCH, BSV, LTC, ADA, BNB, LINK, CRO. If Bitcoin can reclaim the $12,200 level, several altcoins are likely to resume their uptrend."
2020-08-06,Ledger has failed to fully fix a major vulnerability that allows for a “Bitcoin Fork” attack.,[0.02090733 0.9331933  0.04589939],negative,-0.912286,A Newly Discovered Vulnerability in Ledger Wallet Could Be Disastrous If Not Properly Fixed,[0.0301663  0.85269135 0.11714233],negative,-0.822525,A Newly Discovered Vulnerability in Ledger Wallet Could Be Disastrous If Not Properly Fixed. Ledger has failed to fully fix a major vulnerability that allows for a “Bitcoin Fork” attack.
2020-08-04,The strong recovery in Bitcoin and altcoins from their weekend lows suggests that the traders are aggressively buying each dip.,[0.9115759  0.05200155 0.03642246],positive,0.8595744,"Price Analysis 8/3: BTC, ETH, XRP, BCH, BSV, LTC, ADA, CRO, BNB, LINK",[0.02894304 0.01944811 0.95160884],neutral,0.0094949305,"Price Analysis 8/3: BTC, ETH, XRP, BCH, BSV, LTC, ADA, CRO, BNB, LINK. The strong recovery in Bitcoin and altcoins from their weekend lows suggests that the traders are aggressively buying each dip."
2020-08-03,"Bitcoin price corrected sharply after reaching $12,000 but the strong bounce from BTC and altcoins shows bulls are intent on pushing prices higher.",[0.8826666  0.09246306 0.02487042],positive,0.7902035,"Top 5 Cryptocurrencies to Watch This Week: BTC, ETH, LINK, VET, LTC",[0.03678263 0.02036798 0.94284934],neutral,0.016414652,"Top 5 Cryptocurrencies to Watch This Week: BTC, ETH, LINK, VET, LTC. Bitcoin price corrected sharply after reaching $12,000 but the strong bounce from BTC and altcoins shows bulls are intent on pushing prices higher."
2020-08-01,Bitcoin finally broke through the $11.2K resistance and Ethereum’s continued strength is likely to pull several altcoin prices higher.,[0.9453832  0.03324386 0.02137287],positive,0.91213936,"Price Analysis 7/31: BTC, ETH, XRP, BCH, BSV, LTC, ADA,CRO, BNB, EOS",[0.02829345 0.0200626  0.95164394],neutral,0.008230854,"Price Analysis 7/31: BTC, ETH, XRP, BCH, BSV, LTC, ADA,CRO, BNB, EOS. Bitcoin finally broke through the $11.2K resistance and Ethereum’s continued strength is likely to pull several altcoin prices higher."
