date,desc_sentence,desc_logit,desc_prediction,desc_sentiment_score,title_sentence,title_logit,title_prediction,title_sentiment_score,sentence
2019-11-23,"Several top cryptocurrencies have broken below their critical support levels, suggesting that this could be the start of a deeper correction.",[0.01959895 0.96170795 0.01869315],negative,-0.942109,"Price Analysis 22/11: BTC, ETH, XRP, BCH, LTC, EOS, BNB, BSV, XLM, TRX",[0.0316471  0.01834641 0.95000654],neutral,0.013300693,"Price Analysis 22/11: BTC, ETH, XRP, BCH, LTC, EOS, BNB, BSV, XLM, TRX. Several top cryptocurrencies have broken below their critical support levels, suggesting that this could be the start of a deeper correction."
2019-11-21,"Bitcoin price is close to critical support levels, but we anticipate a bounce off the support levels as we take a look at the charts.",[0.711701   0.169405   0.11889406],positive,0.542296,"Price Analysis 20/11: BTC, ETH, XRP, BCH, LTC, EOS, BNB, BSV, XLM, TRX",[0.03185155 0.01808657 0.95006186],neutral,0.013764974,"Price Analysis 20/11: BTC, ETH, XRP, BCH, LTC, EOS, BNB, BSV, XLM, TRX. Bitcoin price is close to critical support levels, but we anticipate a bounce off the support levels as we take a look at the charts."
2019-11-20,"Despite crypto markets reclaiming the capitalization boasted in Nov. 2017 and record volumes, altcoins have seen a declining market share.",[0.00763646 0.9724133  0.01995019],negative,-0.9647768,Altcoin Market Capitalization Shrinks Despite Volume Boost Since 2017,[0.0076271  0.97290975 0.01946313],negative,-0.9652827,"Altcoin Market Capitalization Shrinks Despite Volume Boost Since 2017. Despite crypto markets reclaiming the capitalization boasted in Nov. 2017 and record volumes, altcoins have seen a declining market share."
2019-11-20,"A new prepaid card allows users to top up using cryptocurrency and instantly make fiat withdrawals and purchases at ATMs, stores and websites.",[0.16272    0.01053308 0.826747  ],neutral,0.15218692,"Card Accepts Crypto Top-Ups, Can Be Used in ATMs and Stores Worldwide",[0.04011087 0.01234406 0.94754505],neutral,0.027766803,"Card Accepts Crypto Top-Ups, Can Be Used in ATMs and Stores Worldwide. A new prepaid card allows users to top up using cryptocurrency and instantly make fiat withdrawals and purchases at ATMs, stores and websites."
2019-11-19,"While Bitcoin looks weak, select altcoins are showing resilience and this can shift the focus from Bitcoin to altcoins.",[0.77627224 0.12056644 0.10316131],positive,0.6557058,"Price Analysis 18/11: BTC, ETH, XRP, BCH, LTC, EOS, BNB, BSV, XLM, TRX",[0.03142228 0.01838824 0.9501895 ],neutral,0.013034036,"Price Analysis 18/11: BTC, ETH, XRP, BCH, LTC, EOS, BNB, BSV, XLM, TRX. While Bitcoin looks weak, select altcoins are showing resilience and this can shift the focus from Bitcoin to altcoins."
2019-11-16,The lost $450 million worth cryptocurrency from now-defunct crypto exchange WEX could allegedly be transferred to a fund belonging to Russian intelligence.,[0.02523907 0.2089768  0.76578414],neutral,-0.18373774,BBC: New Files Allegedly Connect $450M in Lost Bitcoin to Russian Intelligence,[0.0754449  0.10585565 0.8186995 ],neutral,-0.030410752,BBC: New Files Allegedly Connect $450M in Lost Bitcoin to Russian Intelligence. The lost $450 million worth cryptocurrency from now-defunct crypto exchange WEX could allegedly be transferred to a fund belonging to Russian intelligence.
2019-11-16,"Bitcoin price looks weak but this fall below $8,500 might turn out to be a buying opportunity.",[0.41038013 0.2504443  0.3391756 ],positive,0.15993583,"Price Analysis 15/11: BTC, ETH, XRP, BCH, LTC, EOS, BNB, BSV, XLM, TRX",[0.03096488 0.01843958 0.9505955 ],neutral,0.0125253,"Price Analysis 15/11: BTC, ETH, XRP, BCH, LTC, EOS, BNB, BSV, XLM, TRX. Bitcoin price looks weak but this fall below $8,500 might turn out to be a buying opportunity."
2019-11-14,"While Bitcoin price action remains lackluster, altcoins are attempting to make a strong upside move.",[0.9460723  0.02504418 0.02888361],positive,0.9210281,"Price Analysis 13/11: BTC, ETH, XRP, BCH, LTC, EOS, BNB, BSV, XLM, TRX",[0.03236642 0.01793099 0.94970256],neutral,0.014435431,"Price Analysis 13/11: BTC, ETH, XRP, BCH, LTC, EOS, BNB, BSV, XLM, TRX. While Bitcoin price action remains lackluster, altcoins are attempting to make a strong upside move."
2019-11-13,"Grin received an anonymous 50 BTC donation to its General Fund on Nov. 11, sparking a bizarre rumor that it was from Bitcoin creator Satoshi Nakamoto.",[0.12679183 0.06670115 0.806507  ],neutral,0.060090683,"Grin Receives Anonymous 50 BTC Donation, Sparking Satoshi Rumors",[0.5694178  0.01930256 0.41127965],positive,0.5501152,"Grin Receives Anonymous 50 BTC Donation, Sparking Satoshi Rumors. Grin received an anonymous 50 BTC donation to its General Fund on Nov. 11, sparking a bizarre rumor that it was from Bitcoin creator Satoshi Nakamoto."
2019-11-12,Bitcoin is at a critical level. Will it bounce off the current level or plummet below it? Let’s analyze the charts.,[0.03424379 0.06875717 0.89699906],neutral,-0.03451338,"Price Analysis 11/11: BTC, ETH, XRP, BCH, LTC, EOS, BNB, BSV, XLM, TRX",[0.02969066 0.02000846 0.9503009 ],neutral,0.009682201,"Price Analysis 11/11: BTC, ETH, XRP, BCH, LTC, EOS, BNB, BSV, XLM, TRX. Bitcoin is at a critical level. Will it bounce off the current level or plummet below it? Let’s analyze the charts."
2019-11-11,The top-performing cryptocurrencies of the past seven days are showing signs of bottoming out. Is it a good time to buy?,[0.05943967 0.67299753 0.2675628 ],negative,-0.6135579,"Top-5 Cryptos This Week: XTZ, ATOM, XLM, LTC, EOS",[0.04683198 0.02044593 0.9327221 ],neutral,0.026386054,"Top-5 Cryptos This Week: XTZ, ATOM, XLM, LTC, EOS. The top-performing cryptocurrencies of the past seven days are showing signs of bottoming out. Is it a good time to buy?"
2019-11-09,Several cryptocurrencies have turned down sharply from their overhead resistance levels. This is a sign of weakness.,[0.00924497 0.97227234 0.01848277],negative,-0.96302736,"Price Analysis 08/11: BTC, ETH, XRP, BCH, LTC, EOS, BNB, BSV, XLM, TRX",[0.03074817 0.01881774 0.9504341 ],neutral,0.011930425,"Price Analysis 08/11: BTC, ETH, XRP, BCH, LTC, EOS, BNB, BSV, XLM, TRX. Several cryptocurrencies have turned down sharply from their overhead resistance levels. This is a sign of weakness."
2019-11-04,Bitcoin’s price action slows as Litecoin looks poised for significant gains.,[0.05739715 0.8482716  0.09433126],negative,-0.7908745,"As Bitcoin Price Consolidates, Litecoin Looks Ripe for Massive Gains",[0.7992173  0.03318874 0.16759397],positive,0.7660285,"As Bitcoin Price Consolidates, Litecoin Looks Ripe for Massive Gains. Bitcoin’s price action slows as Litecoin looks poised for significant gains."
2019-11-02,The crypto market has pulled back but traders might view the current dip as a buying opportunity as long as critical support levels are not violated.,[0.60948104 0.33169323 0.05882575],positive,0.2777878,"Price Analysis 01/11: BTC, ETH, XRP, BCH, LTC, EOS, BNB, BSV, XLM, TRX",[0.02939614 0.01931119 0.95129263],neutral,0.010084957,"Price Analysis 01/11: BTC, ETH, XRP, BCH, LTC, EOS, BNB, BSV, XLM, TRX. The crypto market has pulled back but traders might view the current dip as a buying opportunity as long as critical support levels are not violated."
2019-10-31,Many cryptocurrencies are in a pullback which may be viewed as a buying opportunity. What are the critical levels to watch out for?,[0.03171687 0.3384631  0.62982005],neutral,-0.30674624,"Price Analysis 30/10: BTC, ETH, XRP, BCH, LTC, EOS, BNB, BSV, TRX, XLM",[0.02933976 0.0199438  0.9507164 ],neutral,0.009395959,"Price Analysis 30/10: BTC, ETH, XRP, BCH, LTC, EOS, BNB, BSV, TRX, XLM. Many cryptocurrencies are in a pullback which may be viewed as a buying opportunity. What are the critical levels to watch out for?"
2019-10-29,"After last week’s volatility, traders could be anticipating that the crypto market will consolidate the gains before starting next move up.",[0.6018324  0.07090017 0.32726744],positive,0.5309322,"Price Analysis 28/10: BTC, ETH, XRP, BCH, LTC, EOS, BNB, BSV, TRX, XLM",[0.03035214 0.01939662 0.9502512 ],neutral,0.010955526,"Price Analysis 28/10: BTC, ETH, XRP, BCH, LTC, EOS, BNB, BSV, TRX, XLM. After last week’s volatility, traders could be anticipating that the crypto market will consolidate the gains before starting next move up."
2019-10-26,Bitcoin managed a sharp turnaround just a day after 10% price dump. Does this increase the possibility of a bottom formation?,[0.5854059  0.15667583 0.2579182 ],positive,0.42873007,"Price Analysis 25/10: BTC, ETH, XRP, BCH, LTC, EOS, BNB, BSV, XLM, TRX",[0.03248739 0.01784859 0.949664  ],neutral,0.0146388,"Price Analysis 25/10: BTC, ETH, XRP, BCH, LTC, EOS, BNB, BSV, XLM, TRX. Bitcoin managed a sharp turnaround just a day after 10% price dump. Does this increase the possibility of a bottom formation?"
2019-10-24,The country that tried to ban Bitcoin in 2013 is now home to some of the world’s most permissive ICO regulations.,[0.05209996 0.21183154 0.73606855],neutral,-0.15973158,Thailand Pushes Permissive Regulations as First Legal ICO Is Launched,[0.11902724 0.01769503 0.86327773],neutral,0.10133221,Thailand Pushes Permissive Regulations as First Legal ICO Is Launched. The country that tried to ban Bitcoin in 2013 is now home to some of the world’s most permissive ICO regulations.
2019-10-24,The crypto space is deep in the red. Is this a bear trap or the start of a new downtrend? Let’s analyze the charts.,[0.03469489 0.174978   0.79032713],neutral,-0.14028311,"Price Analysis 23/10: BTC, ETH, XRP, BCH, LTC, EOS, BNB, BSV, XLM, TRX",[0.03100721 0.01861845 0.9503743 ],neutral,0.012388764,"Price Analysis 23/10: BTC, ETH, XRP, BCH, LTC, EOS, BNB, BSV, XLM, TRX. The crypto space is deep in the red. Is this a bear trap or the start of a new downtrend? Let’s analyze the charts."
2019-10-23,The Litecoin Foundation has published two new draft Litecoin Improvement Proposals that work toward establishing privacy features for the network.,[0.666129   0.01038094 0.32349005],positive,0.65574807,Litecoin Foundation Pitches Opt-In MimbleWimble Via Extension Blocks,[0.38414627 0.00725402 0.6085997 ],neutral,0.37689227,Litecoin Foundation Pitches Opt-In MimbleWimble Via Extension Blocks. The Litecoin Foundation has published two new draft Litecoin Improvement Proposals that work toward establishing privacy features for the network.
2019-10-22,"Several major cryptocurrencies are showing signs of a possible trend reversal. If the bounce sustains, many could become optimal buying opportunities.",[0.61699766 0.2963108  0.08669154],positive,0.32068685,"Price Analysis 21/10: BTC, ETH, XRP, BCH, LTC, EOS, BNB, BSV, XLM, TRX",[0.03133756 0.01843186 0.9502306 ],neutral,0.012905698,"Price Analysis 21/10: BTC, ETH, XRP, BCH, LTC, EOS, BNB, BSV, XLM, TRX. Several major cryptocurrencies are showing signs of a possible trend reversal. If the bounce sustains, many could become optimal buying opportunities."
2019-10-19,Bitcoin is at a critical crossroad. What are the different possibilities and important levels to watch out for? Let’s analyze the charts.,[0.04344285 0.02265508 0.933902  ],neutral,0.020787772,"Price Analysis 18/10: BTC, ETH, XRP, BCH, LTC, EOS, BNB, BSV, XLM, LEO",[0.03290106 0.01809855 0.94900036],neutral,0.01480251,"Price Analysis 18/10: BTC, ETH, XRP, BCH, LTC, EOS, BNB, BSV, XLM, LEO. Bitcoin is at a critical crossroad. What are the different possibilities and important levels to watch out for? Let’s analyze the charts."
2019-10-17,Many major cryptocurrencies were rejected at their overhead resistances which shows weakness within the market. Is a bear market developing?,[0.01625712 0.9398175  0.04392528],negative,-0.9235604,"Price Analysis 16/10: BTC, ETH, XRP, BCH, LTC, EOS, BNB, BSV, XLM, TRX",[0.03045527 0.01894653 0.9505982 ],neutral,0.0115087405,"Price Analysis 16/10: BTC, ETH, XRP, BCH, LTC, EOS, BNB, BSV, XLM, TRX. Many major cryptocurrencies were rejected at their overhead resistances which shows weakness within the market. Is a bear market developing?"
2019-10-15,"Most major cryptocurrencies are in a consolidation, which will soon result in a large directional move. How should traders be placed in order to benefit from it?",[0.07486498 0.02429199 0.900843  ],neutral,0.05057299,"Price Analysis 14/10: BTC, ETH, XRP, BCH, LTC, EOS, BNB, BSV, XLM, TRX",[0.03011766 0.01918315 0.95069915],neutral,0.010934509,"Price Analysis 14/10: BTC, ETH, XRP, BCH, LTC, EOS, BNB, BSV, XLM, TRX. Most major cryptocurrencies are in a consolidation, which will soon result in a large directional move. How should traders be placed in order to benefit from it?"
2019-10-14,"As Litecoin celebrated its eighth birthday on Oct. 13, its founder Charlie Lee fended off criticism about LTC and the Foundation’s finances.",[0.03078759 0.893133   0.07607934],negative,-0.8623454,Litecoin Turns 8 — Charlie Lee Says Foundation Not Near Bankruptcy,[0.3442834  0.10551436 0.55020225],neutral,0.23876905,"Litecoin Turns 8 — Charlie Lee Says Foundation Not Near Bankruptcy. As Litecoin celebrated its eighth birthday on Oct. 13, its founder Charlie Lee fended off criticism about LTC and the Foundation’s finances."
2019-10-14,"Litecoin and other alts are becoming increasaingly prevalent among crypto “sextortionists” since they allow to avoid detection more easily, a new research says.",[0.02077262 0.7563798  0.2228476 ],negative,-0.73560715,Crypto ‘Sextortionists’ Turn to Litecoin to Avoid Detection: Report,[0.02307819 0.16937305 0.80754876],neutral,-0.14629486,"Crypto ‘Sextortionists’ Turn to Litecoin to Avoid Detection: Report. Litecoin and other alts are becoming increasaingly prevalent among crypto “sextortionists” since they allow to avoid detection more easily, a new research says."
2019-10-12,Does the pullback in Bitcoin price and most major altcoins indicate that lower levels are likely? Let’s study the charts.,[0.05690697 0.18062252 0.7624705 ],neutral,-0.12371555,"Price Analysis 11/10: BTC, ETH, XRP, BCH, LTC, EOS, BNB, BSV, XLM, TRX",[0.03031581 0.01933636 0.95034784],neutral,0.010979453,"Price Analysis 11/10: BTC, ETH, XRP, BCH, LTC, EOS, BNB, BSV, XLM, TRX. Does the pullback in Bitcoin price and most major altcoins indicate that lower levels are likely? Let’s study the charts."
2019-10-10,Bitcoin and select altcoins are showing signs of bottoming out. Can they start a new uptrend? Let’s study the charts.,[0.04963655 0.17036982 0.7799936 ],neutral,-0.120733276,"Price Analysis 09/10: BTC, ETH, XRP, BCH, LTC, EOS, BNB, BSV, XLM, TRX",[0.02991389 0.01923733 0.9508488 ],neutral,0.0106765535,"Price Analysis 09/10: BTC, ETH, XRP, BCH, LTC, EOS, BNB, BSV, XLM, TRX. Bitcoin and select altcoins are showing signs of bottoming out. Can they start a new uptrend? Let’s study the charts."
2019-10-08,"Bitcoin looks to be stabilizing. If that happens, select altcoins might outperform. Let’s study the charts.",[0.14970815 0.08686329 0.76342857],neutral,0.062844865,"Price Analysis 07/10: BTC, ETH, XRP, BCH, LTC, EOS, BNB, BSV, XLM, ADA",[0.03114406 0.01843843 0.95041746],neutral,0.012705633,"Price Analysis 07/10: BTC, ETH, XRP, BCH, LTC, EOS, BNB, BSV, XLM, ADA. Bitcoin looks to be stabilizing. If that happens, select altcoins might outperform. Let’s study the charts."
2019-10-05,A few altcoins are looking strong. Is it a good time to buy or is this only a dead cat bounce? Let’s study the charts.,[0.07004215 0.02812058 0.9018373 ],neutral,0.041921563,"Price Analysis 04/10: BTC, ETH, XRP, BCH, LTC, EOS, BNB, BSV, XLM, LEO",[0.03267872 0.0178569  0.9494644 ],neutral,0.014821818,"Price Analysis 04/10: BTC, ETH, XRP, BCH, LTC, EOS, BNB, BSV, XLM, LEO. A few altcoins are looking strong. Is it a good time to buy or is this only a dead cat bounce? Let’s study the charts."
2019-10-03,"After a shallow pullback, will major cryptocurrencies extend their decline? Let’s study the charts.",[0.05002747 0.17167681 0.7782957 ],neutral,-0.12164934,"Price Analysis 02/10: BTC, ETH, XRP, BCH, LTC, EOS, BNB, BSV, XLM, LEO",[0.03174425 0.01839182 0.9498639 ],neutral,0.013352426,"Price Analysis 02/10: BTC, ETH, XRP, BCH, LTC, EOS, BNB, BSV, XLM, LEO. After a shallow pullback, will major cryptocurrencies extend their decline? Let’s study the charts."
2019-10-01,"Most major cryptocurrencies have stopped falling. They can start a pullback, which will offer buying opportunities for aggressive traders.",[0.37768897 0.5562378  0.06607321],negative,-0.17854884,"Price Analysis 30/09: BTC, ETH, XRP, BCH, LTC, EOS, BNB, BSV, XLM, LEO",[0.03369488 0.01740013 0.94890505],neutral,0.016294751,"Price Analysis 30/09: BTC, ETH, XRP, BCH, LTC, EOS, BNB, BSV, XLM, LEO. Most major cryptocurrencies have stopped falling. They can start a pullback, which will offer buying opportunities for aggressive traders."
2019-09-28,Keep a close eye on Bitcoin for the next few days as a strong bounce might offer a good buying opportunity for traders who missed the bus last time.,[0.63143647 0.0185823  0.34998122],positive,0.6128542,"Price Analysis 27/09: BTC, ETH, XRP, BCH, LTC, EOS, BNB, BSV, XLM, LEO",[0.03645368 0.01668424 0.94686204],neutral,0.019769443,"Price Analysis 27/09: BTC, ETH, XRP, BCH, LTC, EOS, BNB, BSV, XLM, LEO. Keep a close eye on Bitcoin for the next few days as a strong bounce might offer a good buying opportunity for traders who missed the bus last time."
2019-09-26,Is the current fall the start of a new bear market or is this a bear trap? Let’s analyze the charts.,[0.03071643 0.07338487 0.89589876],neutral,-0.042668443,"Price Analysis 25/09: BTC, ETH, XRP, BCH, LTC, EOS, BNB, BSV, XLM, LEO",[0.0368126  0.01632872 0.94685864],neutral,0.020483883,"Price Analysis 25/09: BTC, ETH, XRP, BCH, LTC, EOS, BNB, BSV, XLM, LEO. Is the current fall the start of a new bear market or is this a bear trap? Let’s analyze the charts."
2019-09-24,Will the launch of Bakkt boost Bitcoin prices? What do the charts project? Let’s analyze the charts.,[0.10009193 0.01182803 0.88808006],neutral,0.0882639,"Price Analysis 23/09: BTC, ETH, XRP, BCH, LTC, EOS, BNB, BSV, XLM, ADA",[0.03506107 0.01693894 0.94799995],neutral,0.018122127,"Price Analysis 23/09: BTC, ETH, XRP, BCH, LTC, EOS, BNB, BSV, XLM, ADA. Will the launch of Bakkt boost Bitcoin prices? What do the charts project? Let’s analyze the charts."
2019-09-21,Can the altcoins continue their rally after a shallow pullback? Let’s analyze the charts.,[0.16073006 0.02668911 0.8125808 ],neutral,0.13404095,"Price Analysis 20/09: BTC, ETH, XRP, BCH, LTC, EOS, BNB, BSV, XLM, ADA",[0.03450993 0.01705564 0.94843435],neutral,0.017454287,"Price Analysis 20/09: BTC, ETH, XRP, BCH, LTC, EOS, BNB, BSV, XLM, ADA. Can the altcoins continue their rally after a shallow pullback? Let’s analyze the charts."
2019-09-19,A new Remote Access Trojan (RAT) malware that steals Bitcoin wallet data has been discovered by security researchers at Zscaler ThreatLabZ.,[0.04217883 0.29460657 0.6632146 ],neutral,-0.25242773,New Bitcoin Wallet-Focused Trojan Uncovered by Security Researchers,[0.07439079 0.21356001 0.7120492 ],neutral,-0.13916922,New Bitcoin Wallet-Focused Trojan Uncovered by Security Researchers. A new Remote Access Trojan (RAT) malware that steals Bitcoin wallet data has been discovered by security researchers at Zscaler ThreatLabZ.
2019-09-19,Altcoins are on fire. Can this rally continue and is this a good time to buy? Let’s analyze the charts.,[0.06875121 0.02235982 0.908889  ],neutral,0.046391387,"Price Analysis 18/09: BTC, ETH, XRP, BCH, LTC, EOS, BNB, BSV, XLM, ADA",[0.03387126 0.01740267 0.948726  ],neutral,0.016468592,"Price Analysis 18/09: BTC, ETH, XRP, BCH, LTC, EOS, BNB, BSV, XLM, ADA. Altcoins are on fire. Can this rally continue and is this a good time to buy? Let’s analyze the charts."
2019-09-17,The impending launch of Bakkt could likely determine the price of Bitcoin for the next few weeks.,[0.03218995 0.2818298  0.6859802 ],neutral,-0.24963985,"Price Analysis 16/09: BTC, ETH, XRP, BCH, LTC, BNB, EOS, BSV, XMR, ADA",[0.03243114 0.01811269 0.9494561 ],neutral,0.014318449,"Price Analysis 16/09: BTC, ETH, XRP, BCH, LTC, BNB, EOS, BSV, XMR, ADA. The impending launch of Bakkt could likely determine the price of Bitcoin for the next few weeks."
2019-09-12,Bitcoin is gradually drifting down. Is this a buying opportunity or will it fall further? Let’s analyze the charts.,[0.03811345 0.3145986  0.6472879 ],neutral,-0.27648515,"Price Analysis 11/09: BTC, ETH, XRP, BCH, LTC, BNB, EOS, BSV, XMR, ADA",[0.03165651 0.01863789 0.9497056 ],neutral,0.013018621,"Price Analysis 11/09: BTC, ETH, XRP, BCH, LTC, BNB, EOS, BSV, XMR, ADA. Bitcoin is gradually drifting down. Is this a buying opportunity or will it fall further? Let’s analyze the charts."
2019-09-10,The action might shift to altcoins for the next few days. Which altcoins offer a trading opportunity? Let’s analyze the charts.,[0.03638696 0.02351841 0.9400946 ],neutral,0.012868552,"Price Analysis 09/09: BTC, ETH, XRP, BCH, LTC, BNB, EOS, BSV, XMR, ADA",[0.03124253 0.01874623 0.95001125],neutral,0.012496302,"Price Analysis 09/09: BTC, ETH, XRP, BCH, LTC, BNB, EOS, BSV, XMR, ADA. The action might shift to altcoins for the next few days. Which altcoins offer a trading opportunity? Let’s analyze the charts."
2019-09-07,Will Apple’s interest in cryptocurrencies drive the next leg of the up-move? Let’s analyze the charts.,[0.06145136 0.01573221 0.9228164 ],neutral,0.04571915,"Price Analysis 06/09: BTC, ETH, XRP, BCH, LTC, BNB, EOS, BSV, XMR, XLM",[0.03215293 0.0176812  0.95016587],neutral,0.014471732,"Price Analysis 06/09: BTC, ETH, XRP, BCH, LTC, BNB, EOS, BSV, XMR, XLM. Will Apple’s interest in cryptocurrencies drive the next leg of the up-move? Let’s analyze the charts."
2019-09-05,Most major cryptocurrencies are facing selling at higher levels. Is the current dip a buying opportunity or will the price break below recent lows? Let’s analyze the charts.,[0.06629483 0.03659212 0.897113  ],neutral,0.029702712,"Price Analysis 04/09: BTC, ETH, XRP, BCH, LTC, BNB, EOS, BSV, XMR, XLM",[0.03188618 0.01779659 0.95031726],neutral,0.014089588,"Price Analysis 04/09: BTC, ETH, XRP, BCH, LTC, BNB, EOS, BSV, XMR, XLM. Most major cryptocurrencies are facing selling at higher levels. Is the current dip a buying opportunity or will the price break below recent lows? Let’s analyze the charts."
2019-09-03,Bitcoin is attempting a bounce. Will it sustain and resume the uptrend? Let’s analyze the charts.,[0.07076903 0.02488293 0.9043481 ],neutral,0.0458861,"Price Analysis 02/09: BTC, ETH, XRP, BCH, LTC, BNB, EOS, BSV, XLM, XMR",[0.03123991 0.01842347 0.95033664],neutral,0.012816435,"Price Analysis 02/09: BTC, ETH, XRP, BCH, LTC, BNB, EOS, BSV, XLM, XMR. Bitcoin is attempting a bounce. Will it sustain and resume the uptrend? Let’s analyze the charts."
2019-08-31,"Bitcoin is at a strong support level. If it fails to bounce quickly, it is likely to turn negative. Let’s analyze the charts.",[0.04315806 0.21566728 0.74117464],neutral,-0.17250922,"Price Analysis 31/08: BTC, ETH, XRP, BCH, LTC, BNB, EOS, BSV, XLM, ADA",[0.03498629 0.01675458 0.9482592 ],neutral,0.01823171,"Price Analysis 31/08: BTC, ETH, XRP, BCH, LTC, BNB, EOS, BSV, XLM, ADA. Bitcoin is at a strong support level. If it fails to bounce quickly, it is likely to turn negative. Let’s analyze the charts."
2019-08-29,Bitcoin is getting ready for a large move. At what level does it become a buy? Let’s analyze the charts.,[0.03938277 0.02388959 0.93672764],neutral,0.015493173,"Price Analysis 28/08: BTC, ETH, XRP, BCH, LTC, BNB, EOS, BSV, XLM, XMR",[0.03331277 0.0177654  0.9489218 ],neutral,0.015547367,"Price Analysis 28/08: BTC, ETH, XRP, BCH, LTC, BNB, EOS, BSV, XLM, XMR. Bitcoin is getting ready for a large move. At what level does it become a buy? Let’s analyze the charts."
2019-08-28,"Crypto custody solutions are on the rise, and Coinbase appears to be taking over the market — who else is chasing the number one spot?",[0.0734599 0.0244731 0.902067 ],neutral,0.048986796,Crypto Custody Market Overview — Who Are the Biggest Players?,[0.03309542 0.03014851 0.936756  ],neutral,0.002946915,"Crypto Custody Market Overview — Who Are the Biggest Players?. Crypto custody solutions are on the rise, and Coinbase appears to be taking over the market — who else is chasing the number one spot?"
2019-08-27,Bitcoin is in a no-man’s land. At what levels will it indicate a resumption of the uptrend? Let’s analyze the charts.,[0.03492625 0.03945931 0.92561436],neutral,-0.00453306,"Price Analysis 26/08: BTC, ETH, XRP, BCH, LTC, BNB, EOS, BSV, XMR, XLM",[0.03465999 0.01701286 0.9483271 ],neutral,0.017647129,"Price Analysis 26/08: BTC, ETH, XRP, BCH, LTC, BNB, EOS, BSV, XMR, XLM. Bitcoin is in a no-man’s land. At what levels will it indicate a resumption of the uptrend? Let’s analyze the charts."
2019-08-24,Telecommunications company Telx Technologies announces the launch of the first cryptocurrency SIM card wallet that enables transactions via SMS.,[0.22375377 0.01346682 0.7627794 ],neutral,0.21028695,Telx Technologies Launches First Crypto-Facilitating SIM Card,[0.15505731 0.01036334 0.83457935],neutral,0.14469397,Telx Technologies Launches First Crypto-Facilitating SIM Card. Telecommunications company Telx Technologies announces the launch of the first cryptocurrency SIM card wallet that enables transactions via SMS.
