date,desc_sentence,desc_logit,desc_prediction,desc_sentiment_score,title_sentence,title_logit,title_prediction,title_sentiment_score,sentence
2018-04-22,"CEO of CheapAir, which has accepted BTC since 2013 for flight and hotel bookings, asks customers for advice on a considered switch from Coinbase to BitPay.",[0.17539312 0.00922316 0.8153837 ],neutral,0.16616996,Crypto-Friendly CheapAir Asks Customers For Feedback On Switch Away From Coinbase,[0.09346677 0.01250352 0.8940297 ],neutral,0.080963254,"Crypto-Friendly CheapAir Asks Customers For Feedback On Switch Away From Coinbase. CEO of CheapAir, which has accepted BTC since 2013 for flight and hotel bookings, asks customers for advice on a considered switch from Coinbase to BitPay."
2018-04-20,DEX or ERC20 and Lightning Network?  What does a cryptocurrency exchange future look like?,[0.03221329 0.02906113 0.93872565],neutral,0.0031521507,"Decentralized Exchanges, Off-Chain Atomic Swaps, And A Brief Look Into The Future",[0.06303968 0.01412423 0.9228361 ],neutral,0.048915457,"Decentralized Exchanges, Off-Chain Atomic Swaps, And A Brief Look Into The Future. DEX or ERC20 and Lightning Network?  What does a cryptocurrency exchange future look like?"
2018-04-20,"Promising Litecoin payment processing platform Litepay has vanished, but TenX and Korbit have stepped up to fill the void.",[0.31440708 0.20243968 0.48315328],neutral,0.1119674,Litecoin Courting TenX and Korbit - Just a Month after LitePay ‘Breakup’,[0.05587    0.04327415 0.9008559 ],neutral,0.012595855,"Litecoin Courting TenX and Korbit - Just a Month after LitePay ‘Breakup’. Promising Litecoin payment processing platform Litepay has vanished, but TenX and Korbit have stepped up to fill the void."
2018-04-17,"The current situation on the crypto markets is uncertain, with several analysts predicting significant growth towards the end of the year.",[0.9214476  0.02360106 0.05495135],positive,0.8978465,"Bitcoin, Ethereum, Bitcoin Cash, Ripple, Stellar, Litecoin, Cardano, NEO, EOS: Price Analysis, April 16",[0.03165847 0.01887001 0.9494716 ],neutral,0.012788463,"Bitcoin, Ethereum, Bitcoin Cash, Ripple, Stellar, Litecoin, Cardano, NEO, EOS: Price Analysis, April 16. The current situation on the crypto markets is uncertain, with several analysts predicting significant growth towards the end of the year."
2018-04-12,Bitcoin has had rallies in the second quarters of both 2016 and 2017. Are we in for another one?,[0.19157806 0.20290999 0.60551196],neutral,-0.011331931,"Bitcoin, Ethereum, Bitcoin Cash, Ripple, Stellar, Litecoin, Cardano, NEO, EOS: Price Analysis, April 11",[0.03185547 0.01879233 0.9493522 ],neutral,0.013063142,"Bitcoin, Ethereum, Bitcoin Cash, Ripple, Stellar, Litecoin, Cardano, NEO, EOS: Price Analysis, April 11. Bitcoin has had rallies in the second quarters of both 2016 and 2017. Are we in for another one?"
2018-04-10,"The ongoing bear market might not be such a bad thing, as it helps the markets become mature enough for institutional money.",[0.60437405 0.01198706 0.38363892],positive,0.59238696,"Bitcoin, Ethereum, Bitcoin Cash, Ripple, Stellar, Litecoin, Cardano, NEO, EOS: Price Analysis, April 09",[0.03405088 0.01759147 0.9483576 ],neutral,0.01645941,"Bitcoin, Ethereum, Bitcoin Cash, Ripple, Stellar, Litecoin, Cardano, NEO, EOS: Price Analysis, April 09. The ongoing bear market might not be such a bad thing, as it helps the markets become mature enough for institutional money."
2018-04-09,"@Bitcoin, a Twitter account associated with Bitcoin Cash, has been suspended to both applause as well as accusations of the death of free speech.",[0.00953248 0.927841   0.06262653],negative,-0.91830856,"BCH-Promoting Twitter Account @Bitcoin Suspended, Internet Debates ‘Death Of Free Speech’",[0.01564685 0.8602754  0.12407774],negative,-0.8446285,"BCH-Promoting Twitter Account @Bitcoin Suspended, Internet Debates ‘Death Of Free Speech’. @Bitcoin, a Twitter account associated with Bitcoin Cash, has been suspended to both applause as well as accusations of the death of free speech."
2018-04-04,"Litecoin markets dipped again April 4, despite payment network Abra confirming it would use the asset for its smart contracts.",[0.01145803 0.9721286  0.01641327],negative,-0.9606706,Litecoin Fails To Hold Gains From Abra Adoption In Shadow Of LitePay Closure,[0.33196944 0.6367643  0.0312663 ],negative,-0.30479485,"Litecoin Fails To Hold Gains From Abra Adoption In Shadow Of LitePay Closure. Litecoin markets dipped again April 4, despite payment network Abra confirming it would use the asset for its smart contracts."
2018-04-03,Crypto total market cap loses almost 50 percent of value during the first quarter of 2018,[0.00765506 0.97031915 0.02202578],negative,-0.96266407,Crypto Market Sees Around 50 Percent Losses Across The Board At End Of First Quarter 2018,[0.00929934 0.9703408  0.02035981],negative,-0.96104145,Crypto Market Sees Around 50 Percent Losses Across The Board At End Of First Quarter 2018. Crypto total market cap loses almost 50 percent of value during the first quarter of 2018
2018-03-30,"BTC and ETH have briefly dipped below the $7,000 and $400 benchmark respectively after Twitter’sand Mailchimp’s crypto bans.",[0.01019214 0.9686583  0.02114955],negative,-0.9584662,"Crypto Markets See Monthly Lows, BTC Trading Around $7,000",[0.00946539 0.9519395  0.03859507],negative,-0.9424741,"Crypto Markets See Monthly Lows, BTC Trading Around $7,000. BTC and ETH have briefly dipped below the $7,000 and $400 benchmark respectively after Twitter’sand Mailchimp’s crypto bans."
2018-03-28,Both the Litecoin Foundation and Litecoin’s founder have publicly apologized for attaching themselves to the now-defunct Litepay merchant solution.,[0.01390285 0.8797908  0.10630637],negative,-0.86588794,"LitePay Merchant Solution Ceases Operations, Litecoin Foundation Apologizes For Hype",[0.01474555 0.93173087 0.05352349],negative,-0.91698533,"LitePay Merchant Solution Ceases Operations, Litecoin Foundation Apologizes For Hype. Both the Litecoin Foundation and Litecoin’s founder have publicly apologized for attaching themselves to the now-defunct Litepay merchant solution."
2018-03-26,An analytical overview of the stock and crypto markets.,[0.03449721 0.01986149 0.9456413 ],neutral,0.014635725,Cryptocurrency and Equity Markets: Weekly Performance Overview,[0.02940273 0.04044391 0.9301534 ],neutral,-0.011041174,Cryptocurrency and Equity Markets: Weekly Performance Overview. An analytical overview of the stock and crypto markets.
2018-03-26,"A new painting series allows anyone the chance to try to solve its abstract puzzles, with access to cryptocurrencies as a reward to finding the private key.",[0.16217624 0.00975171 0.828072  ],neutral,0.15242453,New Abstract Painting Series Offers Crypto To Anyone Who Can Solve Its Puzzles,[0.17520636 0.00875308 0.8160406 ],neutral,0.16645329,"New Abstract Painting Series Offers Crypto To Anyone Who Can Solve Its Puzzles. A new painting series allows anyone the chance to try to solve its abstract puzzles, with access to cryptocurrencies as a reward to finding the private key."
2018-03-24,The latest technical analysis on top 9 cryptocurrencies.,[0.03315103 0.02454579 0.9423032 ],neutral,0.008605236,"Bitcoin, Ethereum, Bitcoin Cash, Ripple, Stellar, Litecoin, Cardano, NEO, EOS: Price Analysis, March 23",[0.0331289  0.01782311 0.94904804],neutral,0.015305784,"Bitcoin, Ethereum, Bitcoin Cash, Ripple, Stellar, Litecoin, Cardano, NEO, EOS: Price Analysis, March 23. The latest technical analysis on top 9 cryptocurrencies."
2018-03-07,The latest technical analysis on top 9 cryptocurrencies.,[0.03315103 0.02454579 0.9423032 ],neutral,0.008605236,"Bitcoin, Ethereum, Bitcoin Cash, Ripple, Stellar, Litecoin, Cardano, NEO, EOS: Price Analysis, March 06",[0.03500269 0.01680568 0.94819164],neutral,0.018197006,"Bitcoin, Ethereum, Bitcoin Cash, Ripple, Stellar, Litecoin, Cardano, NEO, EOS: Price Analysis, March 06. The latest technical analysis on top 9 cryptocurrencies."
2018-03-21,The CEO of Square and Twitter predicts that BTC will become the world’s ‘single’ future currency.,[0.7023253  0.0080973  0.28957745],positive,0.694228,Twitter CEO Says Bitcoin Will Become World’s ‘Single Currency’ Within A Decade,[0.66449577 0.00918961 0.32631457],positive,0.65530616,Twitter CEO Says Bitcoin Will Become World’s ‘Single Currency’ Within A Decade. The CEO of Square and Twitter predicts that BTC will become the world’s ‘single’ future currency.
2018-03-17,Trading forecast on top 9 cryptocurrencies.,[0.04429375 0.08012928 0.875577  ],neutral,-0.035835534,"Bitcoin, Ethereum, Bitcoin Cash, Ripple, Stellar, Litecoin, Cardano, NEO, EOS: Price Analysis, March 16",[0.03206036 0.01852835 0.9494113 ],neutral,0.013532005,"Bitcoin, Ethereum, Bitcoin Cash, Ripple, Stellar, Litecoin, Cardano, NEO, EOS: Price Analysis, March 16. Trading forecast on top 9 cryptocurrencies."
2018-03-16,Florida law enforcement has arrested a gov’t agency employee for “official misconduct” after being caught crypto mining on the agency’s computers.,[0.02867961 0.8833362  0.08798422],negative,-0.8546566,Florida Gov’t Agency Employee Arrested For Mining Crypto Using Dept. Computers,[0.03063946 0.6982244  0.27113605],negative,-0.66758496,Florida Gov’t Agency Employee Arrested For Mining Crypto Using Dept. Computers. Florida law enforcement has arrested a gov’t agency employee for “official misconduct” after being caught crypto mining on the agency’s computers.
2018-03-15,The latest technical analysis on most popular cryptocurrencies.,[0.03422448 0.02515908 0.9406164 ],neutral,0.009065401,"Bitcoin, Ethereum, Bitcoin Cash, Ripple, Stellar, Litecoin, Cardano, NEO, EOS: Price Analysis, March 14",[0.03374652 0.01785415 0.9483993 ],neutral,0.015892368,"Bitcoin, Ethereum, Bitcoin Cash, Ripple, Stellar, Litecoin, Cardano, NEO, EOS: Price Analysis, March 14. The latest technical analysis on most popular cryptocurrencies."
2018-03-13,Don’t miss the latest trading suggestions.,[0.031702   0.0541351  0.91416293],neutral,-0.022433095,"Bitcoin, Ethereum, Bitcoin Cash, Ripple, Stellar, Litecoin, Cardano, NEO, EOS: Price Analysis, March 12",[0.03209838 0.01830098 0.94960064],neutral,0.013797391,"Bitcoin, Ethereum, Bitcoin Cash, Ripple, Stellar, Litecoin, Cardano, NEO, EOS: Price Analysis, March 12. Don’t miss the latest trading suggestions."
2018-03-09,A market overview with top 9 cryptocurrencies movement analysis.,[0.03838738 0.01989221 0.9417204 ],neutral,0.01849517,"Bitcoin, Ethereum, Bitcoin Cash, Ripple, Stellar, Litecoin, Cardano, NEO, EOS: Price Analysis, March 8",[0.03211544 0.01840237 0.9494822 ],neutral,0.013713071,"Bitcoin, Ethereum, Bitcoin Cash, Ripple, Stellar, Litecoin, Cardano, NEO, EOS: Price Analysis, March 8. A market overview with top 9 cryptocurrencies movement analysis."
2018-03-07,"Crypto exchange and wallet Coinbase is starting its own four-coin index fund, open to all U.S. residents that are also accredited investors.",[0.07965697 0.01075334 0.90958965],neutral,0.068903625,"Crypto Exchange Coinbase Launches Four-Coin Index Fund, Only For Accredited Investors",[0.05970387 0.01495871 0.9253374 ],neutral,0.044745162,"Crypto Exchange Coinbase Launches Four-Coin Index Fund, Only For Accredited Investors. Crypto exchange and wallet Coinbase is starting its own four-coin index fund, open to all U.S. residents that are also accredited investors."
2018-03-05,"Wang Pengjie, a member of China’s top political advisory board, has recently suggested that China create its own regulated crypto exchange.",[0.08092539 0.01363416 0.90544045],neutral,0.06729123,Member Of China’s Main Political Advisory Proposes National Crypto Trading Platform,[0.03993419 0.01960182 0.940464  ],neutral,0.020332372,"Member Of China’s Main Political Advisory Proposes National Crypto Trading Platform. Wang Pengjie, a member of China’s top political advisory board, has recently suggested that China create its own regulated crypto exchange."
2018-03-03,"If you trade, you can’t miss this.",[0.04340838 0.04111389 0.91547775],neutral,0.002294492,"Price Analysis, March 02: Bitcoin, Ethereum, Bitcoin Cash, Ripple, Stellar, Litecoin, Cardano, NEO, EOS",[0.03702238 0.01570302 0.94727457],neutral,0.021319365,"Price Analysis, March 02: Bitcoin, Ethereum, Bitcoin Cash, Ripple, Stellar, Litecoin, Cardano, NEO, EOS. If you trade, you can’t miss this."
2018-02-27,Top 9 cryptocurrency prices analyzed.,[0.02859346 0.04618314 0.92522335],neutral,-0.017589683,"Bitcoin, Ethereum, Bitcoin Cash, Ripple, Stellar, Litecoin, Cardano, NEO, EOS: Price Analysis, Feb. 26",[0.03209224 0.01821198 0.9496958 ],neutral,0.013880257,"Bitcoin, Ethereum, Bitcoin Cash, Ripple, Stellar, Litecoin, Cardano, NEO, EOS: Price Analysis, Feb. 26. Top 9 cryptocurrency prices analyzed."
2018-02-25,"The crypto markets are continuing to decline slightly today, but none of the top ten coins in CoinMarketCap is down more than 5 percent.",[0.00975447 0.97239584 0.0178497 ],negative,-0.96264136,"Crypto Markets Continue To Fall, But Not By Much",[0.01242242 0.97034866 0.0172289 ],negative,-0.9579262,"Crypto Markets Continue To Fall, But Not By Much. The crypto markets are continuing to decline slightly today, but none of the top ten coins in CoinMarketCap is down more than 5 percent."
2018-02-24,Latest trading review on most popular cryptocurrencies.,[0.03307389 0.04307991 0.9238461 ],neutral,-0.010006014,"Bitcoin, Ethereum, Bitcoin Cash, Ripple, Stellar, Litecoin, Cardano, NEO, EOS: Price Analysis, Feb. 23",[0.03319761 0.01754822 0.9492541 ],neutral,0.015649393,"Bitcoin, Ethereum, Bitcoin Cash, Ripple, Stellar, Litecoin, Cardano, NEO, EOS: Price Analysis, Feb. 23. Latest trading review on most popular cryptocurrencies."
2018-02-17,Latest trading review on most popular cryptocurrencies.,[0.03307389 0.04307991 0.9238461 ],neutral,-0.010006014,"Bitcoin, Ethereum, Bitcoin Cash, Ripple, Stellar, Litecoin, Cardano, NEO, EOS: Price Analysis, Feb. 16",[0.03227776 0.01810074 0.9496215 ],neutral,0.014177019,"Bitcoin, Ethereum, Bitcoin Cash, Ripple, Stellar, Litecoin, Cardano, NEO, EOS: Price Analysis, Feb. 16. Latest trading review on most popular cryptocurrencies."
2017-10-19,Latest trading review on most popular cryptocurrencies.,[0.03307389 0.04307991 0.9238461 ],neutral,-0.010006014,"Bitcoin, Ethereum, Bitcoin Cash, Ripple, Litecoin: Price Analysis, October 18",[0.03385069 0.02061987 0.94552946],neutral,0.013230825,"Bitcoin, Ethereum, Bitcoin Cash, Ripple, Litecoin: Price Analysis, October 18. Latest trading review on most popular cryptocurrencies."
2017-10-05,Latest trading review on most popular cryptocurrencies.,[0.03307389 0.04307991 0.9238461 ],neutral,-0.010006014,"Bitcoin, Ethereum, Bitcoin Cash, Ripple, Litecoin: Price Analysis, October 04",[0.04039242 0.01754433 0.9420633 ],neutral,0.022848092,"Bitcoin, Ethereum, Bitcoin Cash, Ripple, Litecoin: Price Analysis, October 04. Latest trading review on most popular cryptocurrencies."
2017-09-30,Latest trading review on most popular cryptocurrencies.,[0.03307389 0.04307991 0.9238461 ],neutral,-0.010006014,"Bitcoin, Ethereum, Bitcoin Cash, Ripple, Litecoin: Price Analysis, September 29",[0.03714518 0.01873085 0.94412404],neutral,0.018414333,"Bitcoin, Ethereum, Bitcoin Cash, Ripple, Litecoin: Price Analysis, September 29. Latest trading review on most popular cryptocurrencies."
2017-09-22,Latest trading review on most popular cryptocurrencies.,[0.03307389 0.04307991 0.9238461 ],neutral,-0.010006014,"Bitcoin, Ethereum, Bitcoin Cash, Ripple, Litecoin: Price Analysis, September 22",[0.0361831  0.01954997 0.944267  ],neutral,0.016633127,"Bitcoin, Ethereum, Bitcoin Cash, Ripple, Litecoin: Price Analysis, September 22. Latest trading review on most popular cryptocurrencies."
2018-02-22,Don’t miss the latest trading review on top 9 most popular cryptocurrencies.,[0.03057138 0.03942268 0.93000597],neutral,-0.0088512935,"Bitcoin, Ethereum, Bitcoin Cash, Ripple, Stellar, Litecoin, Cardano, NEO, EOS: Price Analysis, February 21, 2018",[0.0327379  0.01819965 0.9490624 ],neutral,0.014538251,"Bitcoin, Ethereum, Bitcoin Cash, Ripple, Stellar, Litecoin, Cardano, NEO, EOS: Price Analysis, February 21, 2018. Don’t miss the latest trading review on top 9 most popular cryptocurrencies."
2018-02-20,"The latest top 9 cryptocurrencies analysis, make sure you check it to find out what’s going to happen with the prices.",[0.02666399 0.02907449 0.94426155],neutral,-0.0024104975,"Bitcoin, Ethereum, Bitcoin Cash, Ripple, Stellar, Litecoin, Cardano, NEO, EOS: Price Analysis, Feb. 19",[0.03340759 0.01766243 0.9489299 ],neutral,0.015745161,"Bitcoin, Ethereum, Bitcoin Cash, Ripple, Stellar, Litecoin, Cardano, NEO, EOS: Price Analysis, Feb. 19. The latest top 9 cryptocurrencies analysis, make sure you check it to find out what’s going to happen with the prices."
2018-02-16,A Litecoin hard fork is being likened to the Bitcoin-Bitcoin Cash saga.,[0.05665244 0.02944891 0.91389865],neutral,0.027203534,Litecoin Cash - Another Bitcoin-Bitcoin Cash Saga?,[0.04816204 0.12061447 0.83122355],neutral,-0.07245243,Litecoin Cash - Another Bitcoin-Bitcoin Cash Saga?. A Litecoin hard fork is being likened to the Bitcoin-Bitcoin Cash saga.
2018-02-15,"The cryptomarket stands strong, with all top 9 coins moving up. The question is how high?",[0.13117784 0.02915294 0.8396692 ],neutral,0.1020249,"Bitcoin, Ethereum, Bitcoin Cash, Ripple, Stellar, Litecoin, Cardano, NEO, EOS: Price Analysis, February 14 2018",[0.03073465 0.01825589 0.95100945],neutral,0.012478763,"Bitcoin, Ethereum, Bitcoin Cash, Ripple, Stellar, Litecoin, Cardano, NEO, EOS: Price Analysis, February 14 2018. The cryptomarket stands strong, with all top 9 coins moving up. The question is how high?"
2018-02-15,Litecoin is leading altcoin gains this week as news of a merchant platform excites traders.,[0.94810635 0.0198515  0.0320421 ],positive,0.92825484,Litecoin Price Surges On News Of LTC-Fiat Payment Service And ‘Scam’ Hard Fork,[0.08721011 0.88927174 0.02351811],negative,-0.8020616,Litecoin Price Surges On News Of LTC-Fiat Payment Service And ‘Scam’ Hard Fork. Litecoin is leading altcoin gains this week as news of a merchant platform excites traders.
2018-02-13,"Cryptocurrencies are going up, have you placed your orders already?",[0.07935065 0.20021726 0.7204321 ],neutral,-0.12086661,"Bitcoin, Ethereum, Bitcoin Cash, Ripple, Stellar, Litecoin, Cardano, NEO, EOS: Price Analysis, Feb. 12",[0.03333449 0.01742796 0.9492376 ],neutral,0.015906531,"Bitcoin, Ethereum, Bitcoin Cash, Ripple, Stellar, Litecoin, Cardano, NEO, EOS: Price Analysis, Feb. 12. Cryptocurrencies are going up, have you placed your orders already?"
2018-02-12,"After one of the worst weeks for global markets, see how they’re doing compared to the crypto world.",[0.05732049 0.44632164 0.4963579 ],neutral,-0.38900113,"Equity Markets vs. Cryptocurrency Markets: Weekly Performance Review, Feb. 5 - 11",[0.04288873 0.05277467 0.9043366 ],neutral,-0.009885941,"Equity Markets vs. Cryptocurrency Markets: Weekly Performance Review, Feb. 5 - 11. After one of the worst weeks for global markets, see how they’re doing compared to the crypto world."
2018-02-10,A new study has found that Bitcoin is losing popularity on the Darknet.,[0.00767824 0.9710833  0.02123842],negative,-0.9634051,Is Darknet Done With Bitcoin?,[0.03216795 0.04875585 0.9190762 ],neutral,-0.016587894,Is Darknet Done With Bitcoin?. A new study has found that Bitcoin is losing popularity on the Darknet.
2018-02-10,A technical analysis of cryptocurrencies price and their short-term movements.,[0.02987858 0.02942688 0.9406946 ],neutral,0.00045169517,"Bitcoin, Ethereum, Bitcoin Cash, Ripple, Stellar, Litecoin, Cardano, NEO, EOS: Price Analysis, Feb. 09",[0.03401342 0.01739438 0.94859225],neutral,0.016619034,"Bitcoin, Ethereum, Bitcoin Cash, Ripple, Stellar, Litecoin, Cardano, NEO, EOS: Price Analysis, Feb. 09. A technical analysis of cryptocurrencies price and their short-term movements."
2018-02-08,See if we can find signs of bullishness in the cryptocurrency market.,[0.31632575 0.07180412 0.6118701 ],neutral,0.24452163,"Bitcoin, Ethereum, Bitcoin Cash, Ripple, Stellar, Litecoin, NEM, NEO, EOS: Price Analysis, February 7 2018",[0.02979166 0.01855589 0.95165247],neutral,0.011235772,"Bitcoin, Ethereum, Bitcoin Cash, Ripple, Stellar, Litecoin, NEM, NEO, EOS: Price Analysis, February 7 2018. See if we can find signs of bullishness in the cryptocurrency market."
2018-02-06,"Bitcoin has fallen below $7000, altcoins are moving down as well. See what orders to place in this volatile market, if any.",[0.02181297 0.80705446 0.17113264],negative,-0.7852415,"Bitcoin, Ethereum, Bitcoin Cash, Ripple, Stellar, Litecoin, NEM, NEO, EOS: Price Analysis, Feb 05",[0.03450052 0.01633372 0.9491657 ],neutral,0.018166801,"Bitcoin, Ethereum, Bitcoin Cash, Ripple, Stellar, Litecoin, NEM, NEO, EOS: Price Analysis, Feb 05. Bitcoin has fallen below $7000, altcoins are moving down as well. See what orders to place in this volatile market, if any."
2018-02-06,Tether and Bitfinex are under the spotlight amid a massive pullback in the cryptocurrency markets.,[0.02049974 0.9552311  0.02426917],negative,-0.93473136,All Eyes on Tether Amid Crypto Pull Back,[0.05535972 0.06494678 0.8796935 ],neutral,-0.009587057,All Eyes on Tether Amid Crypto Pull Back. Tether and Bitfinex are under the spotlight amid a massive pullback in the cryptocurrency markets.
2018-02-04,"Cryptocurrency markets bounce back after this week’s losses, with Bitcoin recovering from lows it hadn’t seen since November.",[0.57072204 0.3947253  0.0345527 ],positive,0.17599675,Cryptocurrency Markets Move Back Into Green After Substantial Selloff,[0.7290804  0.15772538 0.11319418],positive,0.571355,"Cryptocurrency Markets Move Back Into Green After Substantial Selloff. Cryptocurrency markets bounce back after this week’s losses, with Bitcoin recovering from lows it hadn’t seen since November."
2018-02-03,"An analytical overview on cryptocurrencies prices, their movements and orders.",[0.02628857 0.03331001 0.9404014 ],neutral,-0.00702144,"Bitcoin, Ethereum, Bitcoin Cash, Ripple, Stellar, Litecoin, NEM, NEO, EOS: Price Analysis, February 2, 2018",[0.03275875 0.01839486 0.9488464 ],neutral,0.014363889,"Bitcoin, Ethereum, Bitcoin Cash, Ripple, Stellar, Litecoin, NEM, NEO, EOS: Price Analysis, February 2, 2018. An analytical overview on cryptocurrencies prices, their movements and orders."
2018-02-02,"In an interview with CT at Blockchain Connect, Litecoin founder Charlie Lee shares his thoughts on crypto adoption, investing, and why he doesn’t try to make predictions.",[0.03993725 0.02126609 0.93879664],neutral,0.018671157,"Charlie Lee: Bullish on Bitcoin And Litecoin Long Term, Short Term Impossible To Predict",[0.11196722 0.04243857 0.84559417],neutral,0.069528654,"Charlie Lee: Bullish on Bitcoin And Litecoin Long Term, Short Term Impossible To Predict. In an interview with CT at Blockchain Connect, Litecoin founder Charlie Lee shares his thoughts on crypto adoption, investing, and why he doesn’t try to make predictions."
2018-02-01,EOS and NEO have joined the club.,[0.07080921 0.00941027 0.9197805 ],neutral,0.06139894,"Bitcoin, Ethereum, Bitcoin Cash, Ripple, Stellar, Litecoin, NEM, NEO, EOS: Price Analysis, Jan. 31",[0.03205188 0.01802959 0.9499185 ],neutral,0.014022281,"Bitcoin, Ethereum, Bitcoin Cash, Ripple, Stellar, Litecoin, NEM, NEO, EOS: Price Analysis, Jan. 31. EOS and NEO have joined the club."
2018-01-31,Multiple fake Charlie Lee accounts on Twitter promise free Litecoin to people that send them Litecoin.,[0.05596446 0.01593441 0.9281012 ],neutral,0.040030047,Multiple ‘Charlie Lee’ Imposter Twitter Accounts Promise Fake LTC Giveaway,[0.0276956 0.3005106 0.6717938],neutral,-0.272815,Multiple ‘Charlie Lee’ Imposter Twitter Accounts Promise Fake LTC Giveaway. Multiple fake Charlie Lee accounts on Twitter promise free Litecoin to people that send them Litecoin.
2018-01-31,"Samsung announced a deal on Monday to produce ASIC chips with Taiwanese foundry TSMC, Bitmain’s supplier of mining hardware.",[0.81169844 0.008239   0.18006252],positive,0.80345947,"Samsung Enters Crypto Mining Market, “Mass Producing” ASIC Chips For China",[0.17352843 0.00961429 0.8168573 ],neutral,0.16391414,"Samsung Enters Crypto Mining Market, “Mass Producing” ASIC Chips For China. Samsung announced a deal on Monday to produce ASIC chips with Taiwanese foundry TSMC, Bitmain’s supplier of mining hardware."
2018-01-31,"What possibilities of purchasing art in crypto exist for museums, art galleries and private investors and what are the advantages of Blockchain technology in art sphere.",[0.06747544 0.01115675 0.9213678 ],neutral,0.056318693,Art and Blockchain: Revolution in Art Collecting,[0.0665297  0.02258845 0.9108819 ],neutral,0.043941244,"Art and Blockchain: Revolution in Art Collecting. What possibilities of purchasing art in crypto exist for museums, art galleries and private investors and what are the advantages of Blockchain technology in art sphere."
2018-01-30,See if you should go long or short.,[0.03178447 0.11917864 0.8490369 ],neutral,-0.08739416,"Bitcoin, Ethereum, Bitcoin Cash, Ripple, Stellar, Litecoin, NEM, Cardano: Price Analysis, Jan. 29",[0.03329719 0.01735335 0.9493495 ],neutral,0.015943835,"Bitcoin, Ethereum, Bitcoin Cash, Ripple, Stellar, Litecoin, NEM, Cardano: Price Analysis, Jan. 29. See if you should go long or short."
